2087,COMPLETED,10/13/2009 13:06,10/13/2009 13:12,343,1r3285752,11,5,,,,,,,,,,,,,,,,,,,,,,,,,,,,,,,,,,,,,,,,,1255464469,2,278,"  First of all, my belief in prayer plays a part in it.  In my lifetime I have had two very improbable requests granted to me by God ( I'm not a Christian, a Jew, OR a Muslim by the way).    But second, my view is that the first option would be unfair not only to the 400 but also to the persons called upon to make the selections.  Choosing death for certain people is a dehumanizing action and no one should have to do that, in my opinion.",,,,,,,,,,,,,,,,,,,,,,,,,,,,
2088,COMPLETED,10/13/2009 13:07,10/13/2009 13:08,44,1r3330819,11,4,,,,,,,,,,,,,,,,,,,,,,,,,,,,,,,,,,,,,,,,,1255464491,2,6,na,,,,,,,,,,,,,,,,,,,,,,,,,,,,
2089,COMPLETED,10/13/2009 13:07,10/13/2009 13:09,85,1r3653648,15,5,,,,,,,,,,,,,,,,,,,,,,,,,,,,,,,,,,,,,,,,,,,,,,,,,,,,,,,,,1255464520,2,40,I'm a gambling man by nature. Without knowing the specifics I'd take the chance of saving everyone.,,,,,,,,,,,,
2090,COMPLETED,10/13/2009 13:08,10/13/2009 13:09,74,1r3355314,10,5,,,,,,,,,,,,,,,,,,,,,,,,,,,,,,,,,,,,,1255464563,1,13,statistically equivalent.,,,,,,,,,,,,,,,,,,,,,,,,,,,,,,,,
2091,COMPLETED,10/13/2009 13:08,10/13/2009 13:10,105,1r2973314,10,5,,,,,,,,,,,,,,,,,,,,,,,,,,,,,,,,,,,,,1255464581,1,33,seems like the best choice,,,,,,,,,,,,,,,,,,,,,,,,,,,,,,,,
2093,COMPLETED,10/13/2009 13:09,10/13/2009 13:10,68,1r2789797,7,5,,,,,,,,,,,,,,,,,,,,,,,,,1255464608,1,20,you have got to be able to give,,,,,,,,,,,,,,,,,,,,,,,,,,,,,,,,,,,,,,,,,,,,
2094,COMPLETED,10/13/2009 13:09,10/13/2009 13:11,81,1r2989846,18,5,,,,,,,,,,,,,,,,,,,,,,,,,,,,,,,,,,,,,,,,,,,,,,,,,,,,,,,,,,,,,,,,,,,,,1255464634,1,27,so that 400 people dont have to die
2096,COMPLETED,10/13/2009 13:10,10/13/2009 13:13,160,1r2658127,9,5,,,,,,,,,,,,,,,,,,,,,,,,,,,,,,,,,1255464765,1,15,that is the better possiblity,,,,,,,,,,,,,,,,,,,,,,,,,,,,,,,,,,,,
2098,COMPLETED,10/13/2009 13:10,10/13/2009 13:11,53,1r2991217,6,5,,,,,,,,,,,,,,,,,,,,,1255464690,2,18,I D K,,,,,,,,,,,,,,,,,,,,,,,,,,,,,,,,,,,,,,,,,,,,,,,,
2099,COMPLETED,10/13/2009 13:13,10/13/2009 13:14,96,1r2803398,2,5,,,,,1255464805,1,75,200 people do not die in this program. In program B there is a greater chance of everyone dying.,,,,,,,,,,,,,,,,,,,,,,,,,,,,,,,,,,,,,,,,,,,,,,,,,,,,,,,,,,,,,,,,
2100,COMPLETED,10/13/2009 13:14,10/13/2009 13:15,111,1r3684273,12,5,,,,,,,,,,,,,,,,,,,,,,,,,,,,,,,,,,,,,,,,,,,,,1255464906,2,46,I don't know it seemed like that B more people would live  ,,,,,,,,,,,,,,,,,,,,,,,,
2101,COMPLETED,10/13/2009 13:17,10/13/2009 13:22,298,1r3671021,10,3,,,,,,,,,,,,,,,,,,,,,,,,,,,,,,,,,,,,,1255465147,2,208,There's a 66.6666 percent chance that everyone predicted will die in program A whereas in program B you know for a fact that only 400 will die instead of the predicted 600 or so.,,,,,,,,,,,,,,,,,,,,,,,,,,,,,,,,
2102,COMPLETED,10/13/2009 13:22,10/13/2009 13:23,74,1r3631560,16,3,,,,,,,,,,,,,,,,,,,,,,,,,,,,,,,,,,,,,,,,,,,,,,,,,,,,,,,,,,,,,1255465399,2,18,less death,,,,,,,,
2103,COMPLETED,10/13/2009 13:27,10/13/2009 13:28,60,1r3689286,2,5,,,,,1255465685,2,27,Even a 33% chance of everyone living is worth a shot,,,,,,,,,,,,,,,,,,,,,,,,,,,,,,,,,,,,,,,,,,,,,,,,,,,,,,,,,,,,,,,,
2104,COMPLETED,10/13/2009 13:29,10/13/2009 13:30,81,1r1342696,5,5,,,,,,,,,,,,,,,,,1255465827,1,20,sounds good,,,,,,,,,,,,,,,,,,,,,,,,,,,,,,,,,,,,,,,,,,,,,,,,,,,,
2105,COMPLETED,10/13/2009 13:31,10/13/2009 13:32,77,1r3799575,11,3,,,,,,,,,,,,,,,,,,,,,,,,,,,,,,,,,,,,,,,,,1255465961,1,17,SAME PERCENTAGE ,,,,,,,,,,,,,,,,,,,,,,,,,,,,
2106,COMPLETED,10/13/2009 13:33,10/13/2009 13:36,187,1r3569434,16,5,,,,,,,,,,,,,,,,,,,,,,,,,,,,,,,,,,,,,,,,,,,,,,,,,,,,,,,,,,,,,1255466052,1,116,because its guaranteed that 200 out of 600 people will live. option B has only a 33% that all 600 will live but a 66% chance that 600 people will die.,,,,,,,,
2107,COMPLETED,10/13/2009 13:33,10/13/2009 13:36,213,1r3301960,9,3,,,,,,,,,,,,,,,,,,,,,,,,,,,,,,,,,1255466134,2,64,If 2/3 of 600 would not be saved that would equal 400 loss of lives.  Program B there would only be 200 loss of lives.  Makes sense to me,,,,,,,,,,,,,,,,,,,,,,,,,,,,,,,,,,,,
2108,COMPLETED,10/13/2009 13:37,10/13/2009 13:38,69,1r3446276,14,5,,,,,,,,,,,,,,,,,,,,,,,,,,,,,,,,,,,,,,,,,,,,,,,,,,,,,1255466296,1,30,I think it would be less people to die,,,,,,,,,,,,,,,,
2109,COMPLETED,10/13/2009 13:39,10/13/2009 13:41,69,1r3774774,9,5,,,,,,,,,,,,,,,,,,,,,,,,,,,,,,,,,1255466450,2,13,Bet on a sure thing,,,,,,,,,,,,,,,,,,,,,,,,,,,,,,,,,,,,
2110,COMPLETED,10/13/2009 13:40,10/13/2009 13:44,295,1r3936915,3,5,,,,,,,,,1255466559,1,136,BECAUSE I THINK YOU ARE ASSURED THAT PEOPLE WILL BE SAFE,,,,,,,,,,,,,,,,,,,,,,,,,,,,,,,,,,,,,,,,,,,,,,,,,,,,,,,,,,,,
2111,COMPLETED,10/13/2009 13:40,10/13/2009 13:41,72,1r3321885,15,5,,,,,,,,,,,,,,,,,,,,,,,,,,,,,,,,,,,,,,,,,,,,,,,,,,,,,,,,,1255466501,1,8,best odds,,,,,,,,,,,,
2112,COMPLETED,10/13/2009 13:41,10/13/2009 13:42,61,1r2575814,9,5,,,,,,,,,,,,,,,,,,,,,,,,,,,,,,,,,1255466519,2,10,just a guess,,,,,,,,,,,,,,,,,,,,,,,,,,,,,,,,,,,,
2113,COMPLETED,10/13/2009 13:42,10/13/2009 13:43,96,1r2034502,11,5,,,,,,,,,,,,,,,,,,,,,,,,,,,,,,,,,,,,,,,,,1255466611,1,22,because I am statistically illiterate,,,,,,,,,,,,,,,,,,,,,,,,,,,,
2115,COMPLETED,10/13/2009 13:44,10/13/2009 13:48,223,1r3356471,8,5,,,,,,,,,,,,,,,,,,,,,,,,,,,,,1255466753,1,162,"well it listed ""Program C"" and ""program D"" but the two answers were ""Program A"" and Program B"", so neither answer made sense. I picked the first one because it may have been the one where 400 people die.  I chose this because there was only a 33% chance that nobody would die if I chose the other one, and a 66% chance that all 600 would. 400 seemed like the safest way to go. You know that if we would GAMBLE with killing all 600 people and word got out that we could have saved 200 of them that people would be pissed because we were playing games with lives when we had a gaurunteed way to save at lease some of those lives. ",,,,,,,,,,,,,,,,,,,,,,,,,,,,,,,,,,,,,,,,
2116,COMPLETED,10/13/2009 13:45,10/13/2009 13:46,47,1r3618710,10,5,,,,,,,,,,,,,,,,,,,,,,,,,,,,,,,,,,,,,1255466765,1,20,like the idea that no one would die,,,,,,,,,,,,,,,,,,,,,,,,,,,,,,,,
2117,COMPLETED,10/13/2009 13:49,10/13/2009 13:52,169,1r3429737,6,5,,,,,,,,,,,,,,,,,,,,,1255467032,1,135,"Well, there is a possibility that no one will die with the second option, but that doesn't mean it's guaranteed.  There is a bigger possibility that 600 people will die.  In the first option, you are guaranteed to save 201 people, no matter what.  I think the option where you know you will be saving some people is better than the off chance that you might save all of them with the other option.",,,,,,,,,,,,,,,,,,,,,,,,,,,,,,,,,,,,,,,,,,,,,,,,
2118,COMPLETED,10/13/2009 13:53,10/13/2009 13:57,187,1r3887574,6,5,,,,,,,,,,,,,,,,,,,,,1255467313,1,111,I'd rather save 201 lives than opt for the higher risk of losing all 600.,,,,,,,,,,,,,,,,,,,,,,,,,,,,,,,,,,,,,,,,,,,,,,,,
2119,COMPLETED,10/13/2009 13:55,10/13/2009 13:58,154,1r3768167,2,5,,,,,1255467424,2,69,there is a probability (however small) that no one will have to die. That's worth taking a chance on.,,,,,,,,,,,,,,,,,,,,,,,,,,,,,,,,,,,,,,,,,,,,,,,,,,,,,,,,,,,,,,,,
2120,COMPLETED,10/13/2009 13:56,10/13/2009 13:59,230,1r3003783,13,3,,,,,,,,,,,,,,,,,,,,,,,,,,,,,,,,,,,,,,,,,,,,,,,,,1255467566,2,30,rather save some than none at all,,,,,,,,,,,,,,,,,,,,
2121,COMPLETED,10/13/2009 13:58,10/13/2009 14:02,230,1r489513,13,5,,,,,,,,,,,,,,,,,,,,,,,,,,,,,,,,,,,,,,,,,,,,,,,,,1255467593,1,157,Both programs comes out to 200  but...the probability factor in progrm B is the clue with the known of 200 with program A.,,,,,,,,,,,,,,,,,,,,
2122,COMPLETED,10/13/2009 14:01,10/13/2009 14:04,198,1r2850585,8,3,,,,,,,,,,,,,,,,,,,,,,,,,,,,,1255467815,2,67,less people may die,,,,,,,,,,,,,,,,,,,,,,,,,,,,,,,,,,,,,,,,
2123,COMPLETED,10/13/2009 14:02,10/13/2009 14:02,44,1r3941655,14,1,,,,,,,,,,,,,,,,,,,,,,,,,,,,,,,,,,,,,,,,,,,,,,,,,,,,,1255467752,2,16,seems reasonablely human,,,,,,,,,,,,,,,,
2124,COMPLETED,10/13/2009 14:03,10/13/2009 14:04,50,1r3158624,17,5,,,,,,,,,,,,,,,,,,,,,,,,,,,,,,,,,,,,,,,,,,,,,,,,,,,,,,,,,,,,,,,,,1255467853,1,15,more people would be saved,,,,
2125,COMPLETED,10/13/2009 14:04,10/13/2009 14:06,120,1r3052795,13,5,,,,,,,,,,,,,,,,,,,,,,,,,,,,,,,,,,,,,,,,,,,,,,,,,1255467891,1,81,"The odds are better with the first answer; in any case, even healthy people will die of disease at times.  I guess I believe that the stronger ones will survive",,,,,,,,,,,,,,,,,,,,
2126,COMPLETED,10/13/2009 14:08,10/13/2009 14:11,148,1r3711557,14,5,,,,,,,,,,,,,,,,,,,,,,,,,,,,,,,,,,,,,,,,,,,,,,,,,,,,,1255468174,2,94,"It seemed no one was sure who will be affected by this disease.  Assuming citizen's took proper precautions and attention was taken to properly educate the population, Program B seemed the appropriate response.",,,,,,,,,,,,,,,,
2128,COMPLETED,10/13/2009 14:13,10/13/2009 14:23,604,1r3801797,2,3,,,,,1255468510,2,494,"The difference between 400 and 600 people dying is not that large of a difference relative to the population of the US.  So, that 1/3 chance that everyone will survive is more beneficial than 1/3 of the people surviving.  Also, no specification is given as to whether the 400 people that die would die randomly, or if it would be someone's hands to make a choice.  The possibility that someone has the choice of who survives rules out Program A for me.",,,,,,,,,,,,,,,,,,,,,,,,,,,,,,,,,,,,,,,,,,,,,,,,,,,,,,,,,,,,,,,,
2129,COMPLETED,10/13/2009 14:14,10/13/2009 14:20,362,1r3542233,9,3,,,,,,,,,,,,,,,,,,,,,,,,,,,,,,,,,1255468552,2,291,"200 IS GAURANTEED - 1/3 PROBABILITY IS JUST THAT, A PROBABILITY",,,,,,,,,,,,,,,,,,,,,,,,,,,,,,,,,,,,
2130,COMPLETED,10/13/2009 14:15,10/13/2009 14:16,60,1r2883344,18,3,,,,,,,,,,,,,,,,,,,,,,,,,,,,,,,,,,,,,,,,,,,,,,,,,,,,,,,,,,,,,,,,,,,,,1255468555,1,8,more people die the better
2131,COMPLETED,10/13/2009 14:16,10/13/2009 14:19,190,1r399907,4,3,,,,,,,,,,,,,1255468661,2,95,"Most information about diseases and cures is pure speculation.  Little science and much political input is the norm.  If there is a purported 33% chance that no one will die, then the percentage is likely higher.",,,,,,,,,,,,,,,,,,,,,,,,,,,,,,,,,,,,,,,,,,,,,,,,,,,,,,,,
2132,COMPLETED,10/13/2009 14:18,10/13/2009 14:23,301,1r2692057,17,5,,,,,,,,,,,,,,,,,,,,,,,,,,,,,,,,,,,,,,,,,,,,,,,,,,,,,,,,,,,,,,,,,1255468808,1,201,The chance for all 600 people being saved is more appealing than  only 200 a sure thing out of 600...,,,,
2133,COMPLETED,10/13/2009 14:19,10/13/2009 14:20,59,1r3623911,6,5,,,,,,,,,,,,,,,,,,,,,1255468790,1,18,liklihood of less people dying,,,,,,,,,,,,,,,,,,,,,,,,,,,,,,,,,,,,,,,,,,,,,,,,
2134,COMPLETED,10/13/2009 14:20,10/13/2009 14:24,262,1r3785805,15,5,,,,,,,,,,,,,,,,,,,,,,,,,,,,,,,,,,,,,,,,,,,,,,,,,,,,,,,,,1255468941,2,145,"Selection A said that only 200 people would be saved, while selection B said that there was a 1/3 probability that 600 people would be saved. I figure that if there is going to be an outbreak of a disease and people are going to die anyway, we should at least try to save as many people as possible.",,,,,,,,,,,,
2136,COMPLETED,10/13/2009 14:24,10/13/2009 14:25,60,1r2079411,10,5,,,,,,,,,,,,,,,,,,,,,,,,,,,,,,,,,,,,,1255469120,2,15,fewer deaths,,,,,,,,,,,,,,,,,,,,,,,,,,,,,,,,
2137,COMPLETED,10/13/2009 14:25,10/13/2009 15:48,4991,1r3197614,5,3,,,,,,,,,,,,,,,,,1255469228,2,4865,probibality is something that can vary so that means more people can die or LESS than 201 people will die ,,,,,,,,,,,,,,,,,,,,,,,,,,,,,,,,,,,,,,,,,,,,,,,,,,,,
2138,COMPLETED,10/13/2009 14:30,10/13/2009 14:32,89,1r2606429,3,5,,,,,,,,,1255469485,1,61,A 33% chance of saving everybody isn't worth the guarantee that 33% will definitely survive. And there's a much greater possibility that all 600 people will die anyway.,,,,,,,,,,,,,,,,,,,,,,,,,,,,,,,,,,,,,,,,,,,,,,,,,,,,,,,,,,,,
2139,COMPLETED,10/13/2009 14:32,10/13/2009 14:34,129,1r3394300,1,5,1255469616,1,70,program a will save 200 whereas program be is a gamble of saving any,,,,,,,,,,,,,,,,,,,,,,,,,,,,,,,,,,,,,,,,,,,,,,,,,,,,,,,,,,,,,,,,,,,,
2140,COMPLETED,10/13/2009 14:32,10/13/2009 14:34,122,1r2826834,12,3,,,,,,,,,,,,,,,,,,,,,,,,,,,,,,,,,,,,,,,,,,,,,1255469621,2,68,"A.  Is not an assumption, but is supose to be facual.    B.  Is an assumption, which could be wrong.",,,,,,,,,,,,,,,,,,,,,,,,
2141,COMPLETED,10/13/2009 14:33,10/13/2009 14:34,61,1r2862140,16,5,,,,,,,,,,,,,,,,,,,,,,,,,,,,,,,,,,,,,,,,,,,,,,,,,,,,,,,,,,,,,1255469618,2,32,If there is a chance that no one will die it is worth taking that chance,,,,,,,,
2142,COMPLETED,10/13/2009 14:34,10/13/2009 14:36,140,1r3606308,9,5,,,,,,,,,,,,,,,,,,,,,,,,,,,,,,,,,1255469718,2,85,2/3 of 600 is the same number to lose in both questions.,,,,,,,,,,,,,,,,,,,,,,,,,,,,,,,,,,,,
2143,COMPLETED,10/13/2009 14:35,10/13/2009 14:37,102,1r3709722,17,5,,,,,,,,,,,,,,,,,,,,,,,,,,,,,,,,,,,,,,,,,,,,,,,,,,,,,,,,,,,,,,,,,1255469810,2,17,At least some people for sure will be saved,,,,
2144,COMPLETED,10/13/2009 14:35,10/13/2009 14:40,265,1r2592016,9,5,,,,,,,,,,,,,,,,,,,,,,,,,,,,,,,,,1255469884,2,117,I would much rather see a guarantee that at least some of the people would make it versus a chance that no one would make it. ,,,,,,,,,,,,,,,,,,,,,,,,,,,,,,,,,,,,
2145,COMPLETED,10/13/2009 14:36,10/13/2009 14:37,52,1r2547901,5,5,,,,,,,,,,,,,,,,,1255469851,1,7,Sure thing.,,,,,,,,,,,,,,,,,,,,,,,,,,,,,,,,,,,,,,,,,,,,,,,,,,,,
2146,COMPLETED,10/13/2009 14:38,10/13/2009 14:40,146,1r553934,2,5,,,,,1255469960,1,73,Either way people are going to die from that disease.  Less people dieing is better.,,,,,,,,,,,,,,,,,,,,,,,,,,,,,,,,,,,,,,,,,,,,,,,,,,,,,,,,,,,,,,,,
2147,COMPLETED,10/13/2009 14:38,10/13/2009 14:43,345,1r2741090,4,5,,,,,,,,,,,,,1255470173,1,62,"even with a chance that no one will die, if they are wrong then even more people die than with option a. It's no garentee b will work that's why they estimate 600 instead of the 400 for option a",,,,,,,,,,,,,,,,,,,,,,,,,,,,,,,,,,,,,,,,,,,,,,,,,,,,,,,,
2148,COMPLETED,10/13/2009 14:38,10/13/2009 14:39,70,1r2951130,3,5,,,,,,,,,1255469958,2,23,The possibility of more people being saved.,,,,,,,,,,,,,,,,,,,,,,,,,,,,,,,,,,,,,,,,,,,,,,,,,,,,,,,,,,,,
2149,COMPLETED,10/13/2009 14:39,10/13/2009 14:43,217,1r319527,15,5,,,,,,,,,,,,,,,,,,,,,,,,,,,,,,,,,,,,,,,,,,,,,,,,,,,,,,,,,1255470055,2,126,200 is only 1/3 of all the people affected by the disease.  So either there is a guarantee that 1/3 of the people will be saved and no more or there is a slight chance that all 600 could be saved.  So I chose the option where there was a chance that everyone could be saved.  Also 200 is not very many.,,,,,,,,,,,,
2150,COMPLETED,10/13/2009 14:41,10/13/2009 14:43,88,1r2755528,10,5,,,,,,,,,,,,,,,,,,,,,,,,,,,,,,,,,,,,,1255470138,1,46,Anser two gaurantees 400 people will die but the answer I picked gives a 33% chance no one will dies.,,,,,,,,,,,,,,,,,,,,,,,,,,,,,,,,
2151,COMPLETED,10/13/2009 14:42,10/13/2009 14:45,151,1r2875554,5,5,,,,,,,,,,,,,,,,,1255470255,2,67,"It's a very difficult choice.  I suppose I find it hard to simply accept that 399 will definitely NOT be saved under option A, so I chose B, which has a chance, albeit a small one, that everyone will be saved.  ",,,,,,,,,,,,,,,,,,,,,,,,,,,,,,,,,,,,,,,,,,,,,,,,,,,,
2152,COMPLETED,10/13/2009 14:45,10/13/2009 14:53,483,1r3327724,15,5,,,,,,,,,,,,,,,,,,,,,,,,,,,,,,,,,,,,,,,,,,,,,,,,,,,,,,,,,1255470381,2,408,If b works real progress has been made towards elimination of the desease. If not well the knowledge gained will aid in the further research and a much greater future gain for humanity.,,,,,,,,,,,,
2153,COMPLETED,10/13/2009 14:48,10/13/2009 14:49,98,1r2571905,13,5,,,,,,,,,,,,,,,,,,,,,,,,,,,,,,,,,,,,,,,,,,,,,,,,,1255470551,2,39,"It would be possible for the 1/3 to be saved, allowing more people to benefit from the immunity.",,,,,,,,,,,,,,,,,,,,
2154,COMPLETED,10/13/2009 14:49,10/13/2009 14:49,57,1r3462339,8,7,,,,,,,,,,,,,,,,,,,,,,,,,,,,,1255470584,1,13,No comment,,,,,,,,,,,,,,,,,,,,,,,,,,,,,,,,,,,,,,,,
2156,COMPLETED,10/13/2009 14:53,10/13/2009 14:55,138,1r3650277,15,5,,,,,,,,,,,,,,,,,,,,,,,,,,,,,,,,,,,,,,,,,,,,,,,,,,,,,,,,,1255470891,1,31,400 people will die,,,,,,,,,,,,
2157,COMPLETED,10/13/2009 14:55,10/13/2009 15:00,306,1r2766190,14,2,,,,,,,,,,,,,,,,,,,,,,,,,,,,,,,,,,,,,,,,,,,,,,,,,,,,,1255471056,1,155,"in program A, at least there is is chance of that for 200 people to survive.  In program B 1/3 chance of scope for people die, percentage is more.",,,,,,,,,,,,,,,,
2158,COMPLETED,10/13/2009 14:59,10/13/2009 15:00,73,1r3041218,18,5,,,,,,,,,,,,,,,,,,,,,,,,,,,,,,,,,,,,,,,,,,,,,,,,,,,,,,,,,,,,,,,,,,,,,1255471225,1,21,A probability is better than a definite result.
2159,COMPLETED,10/13/2009 15:00,10/13/2009 15:02,97,1r2861357,7,5,,,,,,,,,,,,,,,,,,,,,,,,,1255471302,1,21,best chance for more saved,,,,,,,,,,,,,,,,,,,,,,,,,,,,,,,,,,,,,,,,,,,,
2160,COMPLETED,10/13/2009 15:04,10/13/2009 15:07,157,1r3198384,7,5,,,,,,,,,,,,,,,,,,,,,,,,,1255471574,2,74,"Because the odds are more in favor of it. Plus, there's the key-word, ""chance"" of everybody surviving and if we can save more lives, than, I'd rather do that. ",,,,,,,,,,,,,,,,,,,,,,,,,,,,,,,,,,,,,,,,,,,,
2161,COMPLETED,10/13/2009 15:06,10/13/2009 15:08,113,1r966679,2,5,,,,,1255471678,1,52,it is better that only 400 die instead of 600.,,,,,,,,,,,,,,,,,,,,,,,,,,,,,,,,,,,,,,,,,,,,,,,,,,,,,,,,,,,,,,,,
2163,COMPLETED,10/13/2009 15:09,10/13/2009 15:10,47,1r3001083,2,3,,,,,1255471819,1,22,"I'd rather deal in certainties, rather than uncertainties.",,,,,,,,,,,,,,,,,,,,,,,,,,,,,,,,,,,,,,,,,,,,,,,,,,,,,,,,,,,,,,,,
2164,COMPLETED,10/13/2009 15:13,10/13/2009 15:17,246,1r2713112,17,5,,,,,,,,,,,,,,,,,,,,,,,,,,,,,,,,,,,,,,,,,,,,,,,,,,,,,,,,,,,,,,,,,1255472221,2,24,Either way odds are in favor of saving 200 people.,,,,
2165,COMPLETED,10/13/2009 15:14,10/13/2009 15:18,268,1r3455160,3,5,,,,,,,,,1255472146,2,169,The details for program A said only 199 people would survive out of 600 people. Program B said 1/3 of the 600 would survive which would be 200 people and 2/3 would probably not survive. I would want to be in the program that has more survivors.,,,,,,,,,,,,,,,,,,,,,,,,,,,,,,,,,,,,,,,,,,,,,,,,,,,,,,,,,,,,
2168,COMPLETED,10/13/2009 15:18,10/13/2009 15:20,106,1r4019463,10,5,,,,,,,,,,,,,,,,,,,,,,,,,,,,,,,,,,,,,1255472374,1,44,"I gave that answer because i believed that it gave hope, telling people that 33.3% of people wouldnt die",,,,,,,,,,,,,,,,,,,,,,,,,,,,,,,,
2169,COMPLETED,10/13/2009 15:18,10/13/2009 15:21,132,1r3345147,2,5,,,,,1255472370,2,90,"Probability is not 100% sure, while program A specifically said WILL die.",,,,,,,,,,,,,,,,,,,,,,,,,,,,,,,,,,,,,,,,,,,,,,,,,,,,,,,,,,,,,,,,
2170,COMPLETED,10/13/2009 15:19,10/13/2009 15:20,59,1r3080300,16,7,,,,,,,,,,,,,,,,,,,,,,,,,,,,,,,,,,,,,,,,,,,,,,,,,,,,,,,,,,,,,1255472422,1,19,Chose the lesser of the two evils.,,,,,,,,
2171,COMPLETED,10/13/2009 15:19,10/13/2009 15:21,65,1r3244604,14,5,,,,,,,,,,,,,,,,,,,,,,,,,,,,,,,,,,,,,,,,,,,,,,,,,,,,,1255472428,2,32,"both choices are based on ""maybe it will happen""",,,,,,,,,,,,,,,,
2172,COMPLETED,10/13/2009 15:22,10/13/2009 15:26,251,1r1381614,4,3,,,,,,,,,,,,,1255472634,2,156,"Program A states that 2/3 of the 600 will die. Program B only has a 2/3 chance that anyone will die.  Program A will kill someone, but Program B has a 1/3 chance that no one will die.",,,,,,,,,,,,,,,,,,,,,,,,,,,,,,,,,,,,,,,,,,,,,,,,,,,,,,,,
2173,COMPLETED,10/13/2009 15:22,10/13/2009 15:23,44,1r2515063,11,5,,,,,,,,,,,,,,,,,,,,,,,,,,,,,,,,,,,,,,,,,1255472596,2,16,worth the risk?!,,,,,,,,,,,,,,,,,,,,,,,,,,,,
2174,COMPLETED,10/13/2009 15:23,10/13/2009 15:24,102,1r3508985,5,5,,,,,,,,,,,,,,,,,1255472611,1,76,"If there's a sure-fire way to save any amount of people, it's the more sensible approach. Instead of trying to make sure the formula or medicine or treatment is right with the second option, they can cure some people and start working on the next batch of option A. ",,,,,,,,,,,,,,,,,,,,,,,,,,,,,,,,,,,,,,,,,,,,,,,,,,,,
2176,COMPLETED,10/13/2009 15:31,10/13/2009 15:32,55,1r3235960,4,5,,,,,,,,,,,,,1255473125,2,20,no,,,,,,,,,,,,,,,,,,,,,,,,,,,,,,,,,,,,,,,,,,,,,,,,,,,,,,,,
2177,COMPLETED,10/13/2009 15:32,10/13/2009 15:33,55,1r2523801,13,5,,,,,,,,,,,,,,,,,,,,,,,,,,,,,,,,,,,,,,,,,,,,,,,,,1255473198,2,13,dont know,,,,,,,,,,,,,,,,,,,,
2178,COMPLETED,10/13/2009 15:35,10/13/2009 15:37,138,1r1611152,7,5,,,,,,,,,,,,,,,,,,,,,,,,,1255473370,2,76,What is there to lose if you don't all may die if you do all may live.,,,,,,,,,,,,,,,,,,,,,,,,,,,,,,,,,,,,,,,,,,,,
2179,COMPLETED,10/13/2009 15:36,10/13/2009 15:38,125,1r2593661,13,5,,,,,,,,,,,,,,,,,,,,,,,,,,,,,,,,,,,,,,,,,,,,,,,,,1255473446,2,61,The possibility of a 1/2 probability will save 100% of the 600 is a better deal to me,,,,,,,,,,,,,,,,,,,,
2180,COMPLETED,10/13/2009 15:46,10/13/2009 15:48,125,1r3618465,10,5,,,,,,,,,,,,,,,,,,,,,,,,,,,,,,,,,,,,,1255474094,2,44,not sure,,,,,,,,,,,,,,,,,,,,,,,,,,,,,,,,
2181,COMPLETED,10/13/2009 15:48,10/13/2009 15:52,184,1r3204055,3,3,,,,,,,,,1255474199,2,124,I would rather take my chances and try to save everybody rather than just saving a few people.,,,,,,,,,,,,,,,,,,,,,,,,,,,,,,,,,,,,,,,,,,,,,,,,,,,,,,,,,,,,
2182,COMPLETED,10/13/2009 15:49,10/13/2009 15:49,31,1r3596352,1,5,1255474185,2,10,"The more, the better",,,,,,,,,,,,,,,,,,,,,,,,,,,,,,,,,,,,,,,,,,,,,,,,,,,,,,,,,,,,,,,,,,,,
2183,COMPLETED,10/13/2009 15:51,10/13/2009 15:52,55,1r3275332,10,5,,,,,,,,,,,,,,,,,,,,,,,,,,,,,,,,,,,,,1255474340,2,12,fewer people will die,,,,,,,,,,,,,,,,,,,,,,,,,,,,,,,,
2184,COMPLETED,10/13/2009 15:53,10/13/2009 15:56,173,1r908112,4,5,,,,,,,,,,,,,1255474479,2,88,Atleast there is a chance that no one will die.,,,,,,,,,,,,,,,,,,,,,,,,,,,,,,,,,,,,,,,,,,,,,,,,,,,,,,,,
2185,COMPLETED,10/13/2009 15:54,10/13/2009 15:57,188,1r3107891,10,5,,,,,,,,,,,,,,,,,,,,,,,,,,,,,,,,,,,,,1255474552,1,118,i think i would gamble and do this and maybe less people would die,,,,,,,,,,,,,,,,,,,,,,,,,,,,,,,,
2186,COMPLETED,10/13/2009 15:55,10/13/2009 15:58,171,1r3760046,6,5,,,,,,,,,,,,,,,,,,,,,1255474587,2,113,"I am a bit of a gambler.. and felt that the ""odds"" were favorable.  It is difficult to risk lives(real lives, that is).. But our Military leaders do it daily.",,,,,,,,,,,,,,,,,,,,,,,,,,,,,,,,,,,,,,,,,,,,,,,,
2187,COMPLETED,10/13/2009 16:03,10/13/2009 16:04,74,1r872928,12,5,,,,,,,,,,,,,,,,,,,,,,,,,,,,,,,,,,,,,,,,,,,,,1255475075,2,16,seems like the lesser of two evils to me,,,,,,,,,,,,,,,,,,,,,,,,
2188,COMPLETED,10/13/2009 16:03,10/13/2009 16:07,224,1r3652432,10,5,,,,,,,,,,,,,,,,,,,,,,,,,,,,,,,,,,,,,1255475131,1,132,"Psychologically, I think it's hard for me to look at definite numbers and say Yes, I will support this program that will Definitely result in the deaths of 400 people. Even though that would save 1/3 of the people. It's easier to choose the option that gives you hope, even if it is improbable. There is a 1 in 3 chance that everyone will live. I have to cling to that possibility that everything could be okay.",,,,,,,,,,,,,,,,,,,,,,,,,,,,,,,,
2190,COMPLETED,10/13/2009 16:06,10/13/2009 16:07,69,1r3456556,6,5,,,,,,,,,,,,,,,,,,,,,1255475252,2,22,there's a better chance of having everyone survive,,,,,,,,,,,,,,,,,,,,,,,,,,,,,,,,,,,,,,,,,,,,,,,,
2191,COMPLETED,10/13/2009 16:06,10/13/2009 16:07,57,1r2493843,1,5,1255475245,1,28,It is a given that 1/4 will be saved regardless.,,,,,,,,,,,,,,,,,,,,,,,,,,,,,,,,,,,,,,,,,,,,,,,,,,,,,,,,,,,,,,,,,,,,
2192,COMPLETED,10/13/2009 16:11,10/13/2009 16:12,67,1r2955274,12,5,,,,,,,,,,,,,,,,,,,,,,,,,,,,,,,,,,,,,,,,,,,,,1255475524,2,8,na  ,,,,,,,,,,,,,,,,,,,,,,,,
2193,COMPLETED,10/13/2009 16:11,10/13/2009 17:43,5519,1r3775105,1,5,1255477740,1,3251,A because there is a chance that less people would die because 2/3 chance of no people being saved is too high of a risk.,,,,,,,,,,,,,,,,,,,,,,,,,,,,,,,,,,,,,,,,,,,,,,,,,,,,,,,,,,,,,,,,,,,,
2194,COMPLETED,10/13/2009 16:12,10/13/2009 16:13,100,1r3621432,1,5,1255475618,1,18,guaranteed people will be saved,,,,,,,,,,,,,,,,,,,,,,,,,,,,,,,,,,,,,,,,,,,,,,,,,,,,,,,,,,,,,,,,,,,,
2195,COMPLETED,10/13/2009 16:12,10/13/2009 16:13,99,1r2922117,16,5,,,,,,,,,,,,,,,,,,,,,,,,,,,,,,,,,,,,,,,,,,,,,,,,,,,,,,,,,,,,,1255475577,1,62,"With A, 200 lives are saved.  With be, the percentages favor the death of 600 persons.",,,,,,,,
2196,COMPLETED,10/13/2009 16:13,10/13/2009 16:17,233,1r3125521,16,5,,,,,,,,,,,,,,,,,,,,,,,,,,,,,,,,,,,,,,,,,,,,,,,,,,,,,,,,,,,,,1255475705,2,163,The expected number of deaths for Program B is 400 (2/3x600 + 1/3x0). That is equivalent to the expected number of deaths for Program A. At least with B there is a chance that no one will die.,,,,,,,,
2197,COMPLETED,10/13/2009 16:14,10/13/2009 16:16,68,1r3715828,11,5,,,,,,,,,,,,,,,,,,,,,,,,,,,,,,,,,,,,,,,,,1255475746,2,20,hope odds are with us,,,,,,,,,,,,,,,,,,,,,,,,,,,,
2198,COMPLETED,10/13/2009 16:15,10/13/2009 16:26,685,1r2555837,9,5,,,,,,,,,,,,,,,,,,,,,,,,,,,,,,,,,1255475990,2,412," If I understood well in ""Program B"" it is sure that 200 people will be saved, but in ""Program A"" there is only around 33% of probability that the 600 people would be saved. It is my way of thinking that it's much better to have 200 people saved without taking chances trying to save all 600, with 66% of probabilties of loosing all of them.",,,,,,,,,,,,,,,,,,,,,,,,,,,,,,,,,,,,
2199,COMPLETED,10/13/2009 16:15,10/13/2009 16:18,181,1r3625221,5,1,,,,,,,,,,,,,,,,,1255475834,1,105,A public treatment should have a positive result not a chance of a positive outcome. A one in three chance is not high enough odds for a public health program.,,,,,,,,,,,,,,,,,,,,,,,,,,,,,,,,,,,,,,,,,,,,,,,,,,,,
