744,COMPLETED,10/9/2009 20:12,10/9/2009 20:12,43,1r2191148,3,5,,,,,,,,,1255144346,2,17,go big or go home - gotta take huge chances,,,,,,,,,,,,,,,,,,,,,,,,,,,,,,,,,,,,,,,,,,,,,,,,,,,,,,,,,,,,
746,COMPLETED,10/9/2009 20:12,10/9/2009 20:13,77,1r2551090,18,5,,,,,,,,,,,,,,,,,,,,,,,,,,,,,,,,,,,,,,,,,,,,,,,,,,,,,,,,,,,,,,,,,,,,,1255144401,1,24,beats me
747,COMPLETED,10/9/2009 20:13,10/9/2009 20:14,72,1r2440451,10,5,,,,,,,,,,,,,,,,,,,,,,,,,,,,,,,,,,,,,1255144426,2,31,I woud want less people to die,,,,,,,,,,,,,,,,,,,,,,,,,,,,,,,,
748,COMPLETED,10/9/2009 20:13,10/9/2009 20:15,114,1r2019749,18,5,,,,,,,,,,,,,,,,,,,,,,,,,,,,,,,,,,,,,,,,,,,,,,,,,,,,,,,,,,,,,,,,,,,,,1255144525,1,28,THAY ARE THE SAME
749,COMPLETED,10/9/2009 20:21,10/9/2009 20:22,77,1r4004663,6,5,,,,,,,,,,,,,,,,,,,,,1255144913,1,33,it's better to know that 100% of a program then have it be some kind of a chance and not know for sure.,,,,,,,,,,,,,,,,,,,,,,,,,,,,,,,,,,,,,,,,,,,,,,,,
750,COMPLETED,10/9/2009 20:23,10/9/2009 20:25,86,1r2746644,12,5,,,,,,,,,,,,,,,,,,,,,,,,,,,,,,,,,,,,,,,,,,,,,1255145098,1,26,less people to die,,,,,,,,,,,,,,,,,,,,,,,,
751,COMPLETED,10/9/2009 20:24,10/9/2009 20:26,100,1r3062510,7,3,,,,,,,,,,,,,,,,,,,,,,,,,1255145134,2,45,"Im not really sure I just think its better two save one in every three people, I didnt figure out the math maybe I should have",,,,,,,,,,,,,,,,,,,,,,,,,,,,,,,,,,,,,,,,,,,,
752,COMPLETED,10/9/2009 20:26,10/9/2009 20:50,1402,1r1817468,16,5,,,,,,,,,,,,,,,,,,,,,,,,,,,,,,,,,,,,,,,,,,,,,,,,,,,,,,,,,,,,,1255145421,2,1189,if 2/3 probability = 600 deaths and 1/3 = no deaths then there are missing probabilitys for a range of 1 death to 599 deaths which is greater than 1/3 and less than 2/3.  A SWAG estimate of 3/6(1/2) probability of approximately 299 deaths.  A 50% probability of 299 or less deaths is better than a 100% guarantee of 400 deaths.,,,,,,,,
754,COMPLETED,10/9/2009 20:27,10/9/2009 20:30,155,1r3904072,8,4,,,,,,,,,,,,,,,,,,,,,,,,,,,,,1255145327,2,73,"all of them are going to die sooner or later, better to take a chance of saving them all then just to save less than half",,,,,,,,,,,,,,,,,,,,,,,,,,,,,,,,,,,,,,,,
755,COMPLETED,10/9/2009 20:33,10/9/2009 20:36,188,1r2658092,12,5,,,,,,,,,,,,,,,,,,,,,,,,,,,,,,,,,,,,,,,,,,,,,1255145671,2,143,"If there is a chance everyone can live, take it.",,,,,,,,,,,,,,,,,,,,,,,,
756,COMPLETED,10/9/2009 20:34,10/9/2009 20:35,59,1r3974726,8,5,,,,,,,,,,,,,,,,,,,,,,,,,,,,,1255145706,2,13,Just a gut feeling,,,,,,,,,,,,,,,,,,,,,,,,,,,,,,,,,,,,,,,,
759,COMPLETED,10/9/2009 20:37,10/9/2009 20:39,81,1r2383742,11,5,,,,,,,,,,,,,,,,,,,,,,,,,,,,,,,,,,,,,,,,,1255145922,1,31,Odds were only a 1 in 3 possibility.  ,,,,,,,,,,,,,,,,,,,,,,,,,,,,
761,COMPLETED,10/9/2009 20:38,10/9/2009 20:39,67,1r3134909,5,5,,,,,,,,,,,,,,,,,1255145954,1,21,It will save 1 more person than b,,,,,,,,,,,,,,,,,,,,,,,,,,,,,,,,,,,,,,,,,,,,,,,,,,,,
764,COMPLETED,10/9/2009 20:43,10/9/2009 20:46,164,1r4005920,3,5,,,,,,,,,1255146242,1,118,"I think that if there is a definite outcome than it should be used and hopefully reproduced to help additional peoples.    I don't think that ""guessing"" if something will work is a good idea because all everyone could be lost instead of saving 199.",,,,,,,,,,,,,,,,,,,,,,,,,,,,,,,,,,,,,,,,,,,,,,,,,,,,,,,,,,,,
765,COMPLETED,10/9/2009 20:46,10/9/2009 20:49,153,1r1994896,4,5,,,,,,,,,,,,,1255146504,2,49,"A SAYS THAT 401 FOR SURE WILL DIE  B THERE IS 1/3 CHANCE THAT NONE WILL DIE, THAT IF BETTER THAN A FOR SURE NUMBER.",,,,,,,,,,,,,,,,,,,,,,,,,,,,,,,,,,,,,,,,,,,,,,,,,,,,,,,,
766,COMPLETED,10/9/2009 20:48,10/9/2009 20:52,240,1r3100863,5,5,,,,,,,,,,,,,,,,,1255146684,1,55,"Under the circumstance, 33% survival rate is acceptable.",,,,,,,,,,,,,,,,,,,,,,,,,,,,,,,,,,,,,,,,,,,,,,,,,,,,
767,COMPLETED,10/9/2009 20:50,10/9/2009 20:51,59,1r2501395,12,5,,,,,,,,,,,,,,,,,,,,,,,,,,,,,,,,,,,,,,,,,,,,,1255146693,2,20,I think the chances are better of not getting the disease,,,,,,,,,,,,,,,,,,,,,,,,
768,COMPLETED,10/9/2009 20:50,10/9/2009 20:52,74,1r2734450,14,5,,,,,,,,,,,,,,,,,,,,,,,,,,,,,,,,,,,,,,,,,,,,,,,,,,,,,1255146687,2,44,"I'd rather try to save everyone and take the risk that someone dies, rather than determine that 200 lives are an acceptable loss to save the other 400.",,,,,,,,,,,,,,,,
769,COMPLETED,10/9/2009 20:51,10/9/2009 20:52,52,1r1830097,10,5,,,,,,,,,,,,,,,,,,,,,,,,,,,,,,,,,,,,,1255146730,2,5,na,,,,,,,,,,,,,,,,,,,,,,,,,,,,,,,,
770,COMPLETED,10/9/2009 20:52,10/9/2009 20:53,103,1r2336022,18,5,,,,,,,,,,,,,,,,,,,,,,,,,,,,,,,,,,,,,,,,,,,,,,,,,,,,,,,,,,,,,,,,,,,,,1255146782,1,45,The answer is the same for both options except option A is not certain that 400 people will die while option B 400 people will die.
771,COMPLETED,10/9/2009 20:55,10/9/2009 20:56,73,1r3296282,11,5,,,,,,,,,,,,,,,,,,,,,,,,,,,,,,,,,,,,,,,,,1255146934,1,42,"It's basically the same as the other project, but stated differently",,,,,,,,,,,,,,,,,,,,,,,,,,,,
772,COMPLETED,10/9/2009 20:56,10/9/2009 20:59,139,1r1726253,2,5,,,,,1255147056,1,95,the greatest chance is losing lives.  why not control the amount from the beginning.,,,,,,,,,,,,,,,,,,,,,,,,,,,,,,,,,,,,,,,,,,,,,,,,,,,,,,,,,,,,,,,,
773,COMPLETED,10/9/2009 20:57,10/9/2009 20:59,127,1r2291705,8,5,,,,,,,,,,,,,,,,,,,,,,,,,,,,,1255147132,2,41,"Best to me, is that no one might die.",,,,,,,,,,,,,,,,,,,,,,,,,,,,,,,,,,,,,,,,
774,COMPLETED,10/9/2009 20:57,10/9/2009 20:59,119,1r2904115,17,5,,,,,,,,,,,,,,,,,,,,,,,,,,,,,,,,,,,,,,,,,,,,,,,,,,,,,,,,,,,,,,,,,1255147127,2,52,I gave that answer because every life is preciouse and everyone shpuld be treated equailly and have a chance,,,,
775,COMPLETED,10/9/2009 20:57,10/9/2009 20:59,76,1r2896652,11,5,,,,,,,,,,,,,,,,,,,,,,,,,,,,,,,,,,,,,,,,,1255147114,2,28,"If there is a chance to save more people than just 200, why not take that chance.",,,,,,,,,,,,,,,,,,,,,,,,,,,,
776,COMPLETED,10/9/2009 20:58,10/9/2009 21:00,145,1r2654694,12,5,,,,,,,,,,,,,,,,,,,,,,,,,,,,,,,,,,,,,,,,,,,,,1255147166,1,70,The A choice has only a 1/3 chance of failing. ,,,,,,,,,,,,,,,,,,,,,,,,
777,COMPLETED,10/9/2009 20:58,10/9/2009 21:07,559,1r3373847,3,5,,,,,,,,,1255147156,1,506,"    The math equals the same basically, and there is a chance that there would be no cure for B. It equals the same.  ",,,,,,,,,,,,,,,,,,,,,,,,,,,,,,,,,,,,,,,,,,,,,,,,,,,,,,,,,,,,
778,COMPLETED,10/9/2009 21:01,10/9/2009 21:02,53,1r3689530,10,5,,,,,,,,,,,,,,,,,,,,,,,,,,,,,,,,,,,,,1255147311,2,17,"I cant do math, but i feel like it would be the same.",,,,,,,,,,,,,,,,,,,,,,,,,,,,,,,,
779,COMPLETED,10/9/2009 21:02,10/9/2009 21:04,92,1r4049658,6,5,,,,,,,,,,,,,,,,,,,,,1255147390,1,52,"Because atleast this way, you know 399 will die and there is no if's or buts. The other way, you have a higher chance of losing more people.",,,,,,,,,,,,,,,,,,,,,,,,,,,,,,,,,,,,,,,,,,,,,,,,
780,COMPLETED,10/9/2009 21:05,10/9/2009 21:07,120,1r3965043,11,5,,,,,,,,,,,,,,,,,,,,,,,,,,,,,,,,,,,,,,,,,1255147569,1,69,They are both the same. 1/3 of 600 is 200. But I chose A because of the word probability in the second statement indicating there could be some deviation from that statistic. Where as the first statement said 200 people would be saved.,,,,,,,,,,,,,,,,,,,,,,,,,,,,
781,COMPLETED,10/9/2009 21:05,10/9/2009 21:07,103,1r3787494,10,5,,,,,,,,,,,,,,,,,,,,,,,,,,,,,,,,,,,,,1255147633,1,19,don't know,,,,,,,,,,,,,,,,,,,,,,,,,,,,,,,,
783,COMPLETED,10/9/2009 21:07,10/9/2009 21:09,143,1r4047488,12,5,,,,,,,,,,,,,,,,,,,,,,,,,,,,,,,,,,,,,,,,,,,,,1255147700,1,91,I chose A because I like to deal with exact figures and not percentages. There is always the change that percentage will change and not always for the better.,,,,,,,,,,,,,,,,,,,,,,,,
784,COMPLETED,10/9/2009 21:08,10/9/2009 21:10,169,1r3002385,3,5,,,,,,,,,1255147780,2,71,It seems like the most rational answer to give because it would be better to try and save more people than to settle and only save 1/3 of the people for certain.,,,,,,,,,,,,,,,,,,,,,,,,,,,,,,,,,,,,,,,,,,,,,,,,,,,,,,,,,,,,
785,COMPLETED,10/9/2009 21:10,10/9/2009 21:12,130,1r3900660,18,5,,,,,,,,,,,,,,,,,,,,,,,,,,,,,,,,,,,,,,,,,,,,,,,,,,,,,,,,,,,,,,,,,,,,,1255147914,1,61,Under program A less people will have the chance of dying. 
786,COMPLETED,10/9/2009 21:14,10/9/2009 21:15,93,1r1636798,12,5,,,,,,,,,,,,,,,,,,,,,,,,,,,,,,,,,,,,,,,,,,,,,1255148104,2,45,"It's better to have no people die, in the long run and maybe 600 people die in the long shoot.",,,,,,,,,,,,,,,,,,,,,,,,
787,COMPLETED,10/9/2009 21:14,10/9/2009 21:15,66,1r4033418,16,3,,,,,,,,,,,,,,,,,,,,,,,,,,,,,,,,,,,,,,,,,,,,,,,,,,,,,,,,,,,,,1255148097,2,37,there is a chance that more would survive.  I think we should take it,,,,,,,,
788,COMPLETED,10/9/2009 21:18,10/9/2009 21:19,23,1r1806086,12,7,,,,,,,,,,,,,,,,,,,,,,,,,,,,,,,,,,,,,,,,,,,,,1255148341,2,7,none,,,,,,,,,,,,,,,,,,,,,,,,
789,COMPLETED,10/9/2009 21:21,10/9/2009 21:23,119,1r3821176,2,5,,,,,1255148527,1,75,"It just makes more sense to take a risk with an expected outcome that will save at least a few of the people, rather that take the risk with the unexpected outcome, and have the possibility that everyone will die anyway.",,,,,,,,,,,,,,,,,,,,,,,,,,,,,,,,,,,,,,,,,,,,,,,,,,,,,,,,,,,,,,,,
790,COMPLETED,10/9/2009 21:22,10/9/2009 21:33,688,1r1896442,7,5,,,,,,,,,,,,,,,,,,,,,,,,,1255149120,2,112,"It should be an all or nothing answer. Well honestly, I would say forget trying to save anyone. There are too many people as is. I mean do we really strengthen any generations anymore? Evolution, even on a micro level, has had to have some kind of catalyst. What better way, then let sickness spread, see how strong we really are. If I am one of those six hundred, then I damn myself, and am ok with that. ",,,,,,,,,,,,,,,,,,,,,,,,,,,,,,,,,,,,,,,,,,,,
792,COMPLETED,10/9/2009 21:23,10/9/2009 21:24,61,1r4047412,8,5,,,,,,,,,,,,,,,,,,,,,,,,,,,,,1255148651,2,25,i didn't understand the logic and the letters didn't match so i guess i just picked one,,,,,,,,,,,,,,,,,,,,,,,,,,,,,,,,,,,,,,,,
793,COMPLETED,10/9/2009 21:24,10/9/2009 21:25,56,1r3434239,3,5,,,,,,,,,1255148702,1,29,it just sounds better no real reason,,,,,,,,,,,,,,,,,,,,,,,,,,,,,,,,,,,,,,,,,,,,,,,,,,,,,,,,,,,,
794,COMPLETED,10/9/2009 21:26,10/9/2009 21:30,264,1r4022533,11,5,,,,,,,,,,,,,,,,,,,,,,,,,,,,,,,,,,,,,,,,,1255148895,2,164,"Americans are known for having this mentality. If there is any reasonable chance that all can be saved, rather than a guarantee that many will be lost, we opt for risking our own lives to help each other. It is the most honorable thing to do. It's similar to the military's stance on leaving no man (or woman) behind.    One for all and all for one. We're in this thing together.",,,,,,,,,,,,,,,,,,,,,,,,,,,,
795,COMPLETED,10/9/2009 21:27,10/9/2009 21:28,75,1r2931039,9,5,,,,,,,,,,,,,,,,,,,,,,,,,,,,,,,,,1255148848,2,47,"I would like the certainty of the number better than in A, when I'm only told a certain fraction would be saved.  ",,,,,,,,,,,,,,,,,,,,,,,,,,,,,,,,,,,,
797,COMPLETED,10/9/2009 21:29,10/9/2009 21:32,186,1r3641948,18,5,,,,,,,,,,,,,,,,,,,,,,,,,,,,,,,,,,,,,,,,,,,,,,,,,,,,,,,,,,,,,,,,,,,,,1255149136,2,15,less people die
798,COMPLETED,10/9/2009 21:30,10/9/2009 21:30,46,1r1222474,4,5,,,,,,,,,,,,,1255149029,2,21,chances are good all will live,,,,,,,,,,,,,,,,,,,,,,,,,,,,,,,,,,,,,,,,,,,,,,,,,,,,,,,,
800,COMPLETED,10/9/2009 21:33,10/9/2009 21:35,100,1r2540992,14,5,,,,,,,,,,,,,,,,,,,,,,,,,,,,,,,,,,,,,,,,,,,,,,,,,,,,,1255149274,2,32,made an educated guess without doing any math,,,,,,,,,,,,,,,,
801,COMPLETED,10/9/2009 21:33,10/9/2009 21:36,158,1r3872957,16,3,,,,,,,,,,,,,,,,,,,,,,,,,,,,,,,,,,,,,,,,,,,,,,,,,,,,,,,,,,,,,1255149325,1,56,i thought is was less people possibaly would die,,,,,,,,
802,COMPLETED,10/9/2009 21:34,10/9/2009 21:36,116,1r1991474,3,5,,,,,,,,,1255149355,2,41,it is better to stick together as one and go for saving everyone. im a person who worries about others before myself. why save 199 when there is a chance to save all 699,,,,,,,,,,,,,,,,,,,,,,,,,,,,,,,,,,,,,,,,,,,,,,,,,,,,,,,,,,,,
803,COMPLETED,10/9/2009 21:35,10/9/2009 21:36,84,1r2528026,18,5,,,,,,,,,,,,,,,,,,,,,,,,,,,,,,,,,,,,,,,,,,,,,,,,,,,,,,,,,,,,,,,,,,,,,1255149348,2,38,It's better then losing more people but would like to have no people die.
804,COMPLETED,10/9/2009 21:35,10/9/2009 21:41,361,1r3144286,11,5,,,,,,,,,,,,,,,,,,,,,,,,,,,,,,,,,,,,,,,,,1255149566,1,150,"Program A: half the population could be saved.    Program B: there seems to be less likely of a chance of the population at large at being saved, esp. if you are looking at military triage of mass casualty.",,,,,,,,,,,,,,,,,,,,,,,,,,,,
805,COMPLETED,10/9/2009 21:42,10/9/2009 21:43,94,1r2244981,9,5,,,,,,,,,,,,,,,,,,,,,,,,,,,,,,,,,1255149782,2,37,both are the same !not much of a choice really.,,,,,,,,,,,,,,,,,,,,,,,,,,,,,,,,,,,,
807,COMPLETED,10/9/2009 21:42,10/9/2009 21:44,95,1r1417452,7,5,,,,,,,,,,,,,,,,,,,,,,,,,1255149831,2,39,Better than some be saved than having to lose alot of humans.,,,,,,,,,,,,,,,,,,,,,,,,,,,,,,,,,,,,,,,,,,,,
808,COMPLETED,10/9/2009 21:43,10/9/2009 21:58,891,1r4048474,12,5,,,,,,,,,,,,,,,,,,,,,,,,,,,,,,,,,,,,,,,,,,,,,1255149861,2,834,"I chose answer ""B"" due to the fact that, in answer ""A"", it was certain, beyond any doubt that mos would die. Answer ""B"" gave hope that all could possibly live. ",,,,,,,,,,,,,,,,,,,,,,,,
809,COMPLETED,10/9/2009 21:45,10/9/2009 22:36,3071,1r1110798,17,5,,,,,,,,,,,,,,,,,,,,,,,,,,,,,,,,,,,,,,,,,,,,,,,,,,,,,,,,,,,,,,,,,1255150062,2,2925,"This is an interesting issue. Statistically, it seems (at least at first glance) that the outcomes are equivalent. With either program, any individual in the group of 600 people appears to have a 2/3 chance of dying. The difference, of course, is that with Plan A, if one individual lives (or dies), then all do, whereas with Plan B, at least some individuals (1/3 of the entire group) are guaranteed to live (although, of course, 2/3 are guaranteed to die). It seems that purely mathematical reasoning is of little use, although by discarding that approach quickly, it is possible that I overlooked a subtle detail that might have made a mathematically-based decision more clear. So I tried to come up with an analogy that didn't involve disease. I supposed that a journey had to be made, but with a choice of conveyances: either (A) a creaky old airplane big enough to hold 600 people (but which had a 2/3 chance of crashing en-route and killing everyone aboard), or (B) 600 drivers in individual automobiles on a dangerous winding road on which 400 drivers would die in accidents, but 200 would certainly reach their destinations. Although the analogy isn't perfect (drivers can choose to be careful, whereas airline passengers have little to say about how their aircraft is maintained or operated), I saw two advantages to (B): first, that there was some sense of control (albeit illusory) over one's destiny, and second, that there was a guarantee of at least some survivors. A third advantage to choice (B) (considered independently of its possible effects on the individual victims of the illness) was its comparatively salutary effect on the overall quality of the human gene pool: it seems clear that the results of choice (A) depended heavily on the efficacy of the treatment plan; regardless of whether everyone survived or perished, the gene pool would become neither better nor worse than it was previously, since there was no favorable selection for those individuals better adapted to fighting off the illness. The results of plan (B) would appear to depend more heavily on each individual's natural resistance to the illness; the survivors would presumably have demonstrated an increased resistance that was likely at least partially inherited. After the pandemic ended and the victims were reunited with the remainder of the human race, a larger fraction of the remaining members of the species would be resistant to the disease, thus improving the overall gene pool (albeit at the expense of the some of the individual members of the species).    Finally, one can take a contrarian point of view, and ask which choice a devil's advocate would prefer. Although there is a broadly accepted moral imperative to save as many lives as possible (all conventional analyses of the situation will implicitly assume that saving human lives is a good thing), one can imagine that certain extreme environmentalists, ZPG members, and adherents of Malthus might prefer a choice that is most likely to reduce the excess human population by as many individuals as possible, and to prevent any improvement in the gene pool. Choice (A) has a very good chance of reducing the human population by 600 individuals, and even if the 600 were to get lucky and survive, their survival would have no effect to improve the gene pool. So the devil wins at least something either way with this choice.",,,,
810,COMPLETED,10/9/2009 21:48,10/9/2009 21:50,125,1r1930139,5,5,,,,,,,,,,,,,,,,,1255150230,1,28,because option b didn't really give much hope and at least with a some people will still live,,,,,,,,,,,,,,,,,,,,,,,,,,,,,,,,,,,,,,,,,,,,,,,,,,,,
812,COMPLETED,10/9/2009 21:53,10/9/2009 21:55,143,1r1662884,11,5,,,,,,,,,,,,,,,,,,,,,,,,,,,,,,,,,,,,,,,,,1255150484,1,58,I think the odds are better  with  this option,,,,,,,,,,,,,,,,,,,,,,,,,,,,
813,COMPLETED,10/9/2009 21:53,10/9/2009 21:55,98,1r3755664,1,2,1255150458,2,59,"try to save as many as possible, regardless of risks",,,,,,,,,,,,,,,,,,,,,,,,,,,,,,,,,,,,,,,,,,,,,,,,,,,,,,,,,,,,,,,,,,,,
814,COMPLETED,10/9/2009 21:54,10/9/2009 21:57,202,1r2993276,10,5,,,,,,,,,,,,,,,,,,,,,,,,,,,,,,,,,,,,,1255150503,1,143,....more favorable statistics and prablities for all.,,,,,,,,,,,,,,,,,,,,,,,,,,,,,,,,
815,COMPLETED,10/9/2009 21:56,10/9/2009 21:58,118,1r3958363,7,5,,,,,,,,,,,,,,,,,,,,,,,,,1255150652,1,29,i would take the sure thing,,,,,,,,,,,,,,,,,,,,,,,,,,,,,,,,,,,,,,,,,,,,
816,COMPLETED,10/9/2009 21:56,10/9/2009 21:59,151,1r492322,5,5,,,,,,,,,,,,,,,,,1255150707,1,54,better to have a 100% chance of saving 200 people than only a 33% chance of saving 201 people.,,,,,,,,,,,,,,,,,,,,,,,,,,,,,,,,,,,,,,,,,,,,,,,,,,,,
817,COMPLETED,10/9/2009 21:57,10/9/2009 21:58,85,1r4014013,3,5,,,,,,,,,1255150685,1,37,I would want to try and save as many people as I could. ,,,,,,,,,,,,,,,,,,,,,,,,,,,,,,,,,,,,,,,,,,,,,,,,,,,,,,,,,,,,
818,COMPLETED,10/9/2009 21:59,10/9/2009 22:02,175,1r3888791,11,5,,,,,,,,,,,,,,,,,,,,,,,,,,,,,,,,,,,,,,,,,1255150870,1,97,Both are the same but I had no option for that.  So; just check one or the other.,,,,,,,,,,,,,,,,,,,,,,,,,,,,
819,COMPLETED,10/9/2009 22:05,10/9/2009 22:05,32,1r2450340,4,3,,,,,,,,,,,,,1255151149,1,9,less people will die,,,,,,,,,,,,,,,,,,,,,,,,,,,,,,,,,,,,,,,,,,,,,,,,,,,,,,,,
820,COMPLETED,10/9/2009 22:08,10/9/2009 22:10,104,1r3967557,3,5,,,,,,,,,1255151373,2,44,"I'm not willing to automatically kill 401 people, even if the odds mean the 199 could die.",,,,,,,,,,,,,,,,,,,,,,,,,,,,,,,,,,,,,,,,,,,,,,,,,,,,,,,,,,,,
821,COMPLETED,10/9/2009 22:15,10/9/2009 22:17,117,1r3944884,1,5,1255151783,2,68,cause u save what u can and let everyelse die so its sacrificing to save the others or something,,,,,,,,,,,,,,,,,,,,,,,,,,,,,,,,,,,,,,,,,,,,,,,,,,,,,,,,,,,,,,,,,,,,
822,COMPLETED,10/9/2009 22:22,10/9/2009 22:23,94,1r3313400,2,5,,,,,1255152196,2,30,there is a possibility that NO ONE will die.,,,,,,,,,,,,,,,,,,,,,,,,,,,,,,,,,,,,,,,,,,,,,,,,,,,,,,,,,,,,,,,,
823,COMPLETED,10/9/2009 22:24,10/9/2009 22:26,94,1r1314021,1,5,1255152333,2,39,i like the odds,,,,,,,,,,,,,,,,,,,,,,,,,,,,,,,,,,,,,,,,,,,,,,,,,,,,,,,,,,,,,,,,,,,,
824,COMPLETED,10/9/2009 22:37,10/9/2009 22:38,107,1r3760165,18,5,,,,,,,,,,,,,,,,,,,,,,,,,,,,,,,,,,,,,,,,,,,,,,,,,,,,,,,,,,,,,,,,,,,,,1255153073,1,55,1/3 probability of no deaths vs. certainty of 2/3 of the victims dying.
825,COMPLETED,10/9/2009 22:37,10/9/2009 22:39,74,1r3805856,12,5,,,,,,,,,,,,,,,,,,,,,,,,,,,,,,,,,,,,,,,,,,,,,1255153129,2,11,better odds,,,,,,,,,,,,,,,,,,,,,,,,
826,COMPLETED,10/9/2009 22:38,10/9/2009 22:40,118,1r3354763,17,5,,,,,,,,,,,,,,,,,,,,,,,,,,,,,,,,,,,,,,,,,,,,,,,,,,,,,,,,,,,,,,,,,1255153214,1,7,more people will be saved,,,,
827,COMPLETED,10/9/2009 22:39,10/9/2009 22:40,107,1r3169152,13,7,,,,,,,,,,,,,,,,,,,,,,,,,,,,,,,,,,,,,,,,,,,,,,,,,1255153191,1,58,take the guaranteed savings over 2/3 chance no body will be saved,,,,,,,,,,,,,,,,,,,,
828,COMPLETED,10/9/2009 22:40,10/9/2009 22:41,63,1r3595478,16,5,,,,,,,,,,,,,,,,,,,,,,,,,,,,,,,,,,,,,,,,,,,,,,,,,,,,,,,,,,,,,1255153277,2,25,more likely to save lives,,,,,,,,
829,COMPLETED,10/9/2009 22:43,10/9/2009 22:46,166,1r3967969,15,5,,,,,,,,,,,,,,,,,,,,,,,,,,,,,,,,,,,,,,,,,,,,,,,,,,,,,,,,,1255153494,1,109,its the same outcome other than the words probability in answer B where in A there would be 200 saved,,,,,,,,,,,,
831,COMPLETED,10/9/2009 22:52,10/9/2009 22:56,238,1r4023700,14,5,,,,,,,,,,,,,,,,,,,,,,,,,,,,,,,,,,,,,,,,,,,,,,,,,,,,,1255154043,2,139,"Taking a risk to save all people, since in Program A anyway 400 people are doing to die. ",,,,,,,,,,,,,,,,
832,COMPLETED,10/9/2009 22:55,10/9/2009 22:56,92,1r3108546,1,5,1255154165,2,39,"Both are statistically indeterminable, so I could not care less",,,,,,,,,,,,,,,,,,,,,,,,,,,,,,,,,,,,,,,,,,,,,,,,,,,,,,,,,,,,,,,,,,,,
833,COMPLETED,10/9/2009 22:55,10/9/2009 23:03,463,1r3611912,15,5,,,,,,,,,,,,,,,,,,,,,,,,,,,,,,,,,,,,,,,,,,,,,,,,,,,,,,,,,1255154247,1,340,"In both cases the overall survival rate is the same. ( on average). 200 saved vs. o +o + 600 / 3, so I chose method A because at least this way there is an asurance of 200 being saved for sure. A bird in the hand is worth 2 in the bush. I guess I see( & prefer) the glass as 1/3 full as compared to 2/3 empty.",,,,,,,,,,,,
834,COMPLETED,10/9/2009 22:55,10/9/2009 22:56,84,1r3815808,10,5,,,,,,,,,,,,,,,,,,,,,,,,,,,,,,,,,,,,,1255154171,1,39,why mot try to save everyone,,,,,,,,,,,,,,,,,,,,,,,,,,,,,,,,
835,COMPLETED,10/9/2009 23:05,10/9/2009 23:06,57,1r3517062,17,5,,,,,,,,,,,,,,,,,,,,,,,,,,,,,,,,,,,,,,,,,,,,,,,,,,,,,,,,,,,,,,,,,1255154751,1,26,"I beleive that this is the best way to serve the community better than, vs. than 200 individuals. ",,,,
836,COMPLETED,10/9/2009 23:07,10/9/2009 23:10,159,1r1311212,8,5,,,,,,,,,,,,,,,,,,,,,,,,,,,,,1255154968,2,58,In the first choice 400 people would die.   In the second choice there was a chance that no one would die.  That is a chance worth taking.,,,,,,,,,,,,,,,,,,,,,,,,,,,,,,,,,,,,,,,,
838,COMPLETED,10/9/2009 23:21,10/9/2009 23:24,138,1r2995092,3,5,,,,,,,,,1255155811,2,41,The percentage of saved people is higher with programB,,,,,,,,,,,,,,,,,,,,,,,,,,,,,,,,,,,,,,,,,,,,,,,,,,,,,,,,,,,,
839,COMPLETED,10/9/2009 23:24,10/9/2009 23:26,120,1r4057060,6,5,,,,,,,,,,,,,,,,,,,,,1255155935,2,65,less people would be dead and you didnt give any other option i wouldnt have picked either i dont want anyone to die,,,,,,,,,,,,,,,,,,,,,,,,,,,,,,,,,,,,,,,,,,,,,,,,
840,COMPLETED,10/9/2009 23:27,10/9/2009 23:29,130,1r2855767,2,2,,,,,1255156082,2,95,"A: 400 people will die  B: 2/3 probability that 600 people will die, ie 400 people may die",,,,,,,,,,,,,,,,,,,,,,,,,,,,,,,,,,,,,,,,,,,,,,,,,,,,,,,,,,,,,,,,
842,COMPLETED,10/9/2009 23:34,10/9/2009 23:38,190,1r2950172,2,7,,,,,1255156656,2,29,atleast there is a possibility that no one will die,,,,,,,,,,,,,,,,,,,,,,,,,,,,,,,,,,,,,,,,,,,,,,,,,,,,,,,,,,,,,,,,
843,COMPLETED,10/9/2009 23:37,10/9/2009 23:39,142,1r4058597,1,5,1255156730,1,55,2 chances that no one will be saved as to a 100% chance 200 peoe will be saved,,,,,,,,,,,,,,,,,,,,,,,,,,,,,,,,,,,,,,,,,,,,,,,,,,,,,,,,,,,,,,,,,,,,
844,COMPLETED,10/9/2009 23:40,10/9/2009 23:44,238,1r4051602,17,2,,,,,,,,,,,,,,,,,,,,,,,,,,,,,,,,,,,,,,,,,,,,,,,,,,,,,,,,,,,,,,,,,1255156917,2,123,I believe that this system works well and I'm pleased with it.,,,,
845,COMPLETED,10/9/2009 23:47,10/9/2009 23:51,259,1r3633054,12,5,,,,,,,,,,,,,,,,,,,,,,,,,,,,,,,,,,,,,,,,,,,,,1255157329,1,157,option A insures that some will survive,,,,,,,,,,,,,,,,,,,,,,,,
846,COMPLETED,10/9/2009 23:51,10/9/2009 23:59,481,1r3955654,14,5,,,,,,,,,,,,,,,,,,,,,,,,,,,,,,,,,,,,,,,,,,,,,,,,,,,,,1255157727,1,243,"In program A, there is a 100% chance that at least 200 people will survive, regardless.    In progam B, there is only a 33% chance that all 600 people will survive.  (If not, all 600 people die).   I do not think those are good enough odds.",,,,,,,,,,,,,,,,
847,COMPLETED,10/9/2009 23:52,10/9/2009 23:54,89,1r2269044,10,5,,,,,,,,,,,,,,,,,,,,,,,,,,,,,,,,,,,,,1255157630,1,35,There is probability that nobody might die.,,,,,,,,,,,,,,,,,,,,,,,,,,,,,,,,
849,COMPLETED,10/10/2009 0:13,10/10/2009 0:14,53,1r2284568,16,5,,,,,,,,,,,,,,,,,,,,,,,,,,,,,,,,,,,,,,,,,,,,,,,,,,,,,,,,,,,,,1255158868,2,14,probability is like 50/50 chance,,,,,,,,
850,COMPLETED,10/10/2009 0:17,10/10/2009 0:18,93,1r3181844,8,2,,,,,,,,,,,,,,,,,,,,,,,,,,,,,1255159081,2,38,This answer anymore likes me,,,,,,,,,,,,,,,,,,,,,,,,,,,,,,,,,,,,,,,,
851,COMPLETED,10/10/2009 0:22,10/10/2009 0:23,56,1r3748686,17,3,,,,,,,,,,,,,,,,,,,,,,,,,,,,,,,,,,,,,,,,,,,,,,,,,,,,,,,,,,,,,,,,,1255159370,1,14,Because there's a greater chance to save more people.,,,,
852,COMPLETED,10/10/2009 0:35,10/10/2009 0:37,124,1r3182931,15,5,,,,,,,,,,,,,,,,,,,,,,,,,,,,,,,,,,,,,,,,,,,,,,,,,,,,,,,,,1255160199,1,72,"With the first estimate, only 400 would die, but in estimate 2, many more would die than 400",,,,,,,,,,,,
853,COMPLETED,10/10/2009 0:40,10/10/2009 0:42,121,1r4034703,8,5,,,,,,,,,,,,,,,,,,,,,,,,,,,,,1255160525,1,51,"It was the closest answer to option c.  you want to definitely minimize death, and this is the most surefire way to do it",,,,,,,,,,,,,,,,,,,,,,,,,,,,,,,,,,,,,,,,
854,COMPLETED,10/10/2009 1:14,10/10/2009 1:16,120,1r3624003,9,5,,,,,,,,,,,,,,,,,,,,,,,,,,,,,,,,,1255162535,2,41,definite amount even tho results are the same,,,,,,,,,,,,,,,,,,,,,,,,,,,,,,,,,,,,
