rid,complete,start,end,duration,uniq,qra,qcheck,q1t,q1a,q1t2,q1b,q2t,q2a,q2t2,q2b,q3t,q3a,q3t2,q3b,q4t,q4a,q4t2,q4b,q5t,q5a,q5t2,q5b,q6t,q6a,q6t2,q6b,q7t,q7a,q7t2,q7b,q8t,q8a,q8t2,q8b,q9t,q9a,q9t2,q9b,q10t,q10a,q10t2,q10b,q11t,q11a,q11t2,q11b,q12t,q12a,q12t2,q12b,q13t,q13a,a13t2,q13b,q14t,q14a,q14t2,q14b,q15t,q15a,q15t2,q15b,q16t,q16a,q16t2,q16b,q17t,q17a,q17t2,q17b,q18t,q18a,q18t2,q18b
118,COMPLETED,10/7/2009 9:00,10/7/2009 9:01,39,1r670613,4,5,,,,,,,,,,,,,1254931281,2,5,na,,,,,,,,,,,,,,,,,,,,,,,,,,,,,,,,,,,,,,,,,,,,,,,,,,,,,,,,
119,COMPLETED,10/7/2009 9:08,10/7/2009 9:10,136,1r379481,1,5,1254931750,2,86,"I'm an all or nothing person, and believe it is better to try to save everyone than write off a vast majority outright.",,,,,,,,,,,,,,,,,,,,,,,,,,,,,,,,,,,,,,,,,,,,,,,,,,,,,,,,,,,,,,,,,,,,
120,COMPLETED,10/7/2009 9:13,10/7/2009 9:14,56,1r939913,8,5,,,,,,,,,,,,,,,,,,,,,,,,,,,,,1254932032,1,16,ARE YOU KIDDING ME??? ,,,,,,,,,,,,,,,,,,,,,,,,,,,,,,,,,,,,,,,,
121,COMPLETED,10/7/2009 9:14,10/7/2009 9:15,25,1r310568,15,5,,,,,,,,,,,,,,,,,,,,,,,,,,,,,,,,,,,,,,,,,,,,,,,,,,,,,,,,,1254932107,1,11,it does matter me,,,,,,,,,,,,
122,COMPLETED,10/7/2009 9:16,10/7/2009 9:17,68,1r304095,10,5,,,,,,,,,,,,,,,,,,,,,,,,,,,,,,,,,,,,,1254932224,1,30,I believe that the odds are better on the A program,,,,,,,,,,,,,,,,,,,,,,,,,,,,,,,,
123,COMPLETED,10/7/2009 9:17,10/7/2009 9:18,88,1r770268,9,5,,,,,,,,,,,,,,,,,,,,,,,,,,,,,,,,,1254932298,2,34,I am more comfortable with a sure number of people saved than a prpbable number,,,,,,,,,,,,,,,,,,,,,,,,,,,,,,,,,,,,
124,COMPLETED,10/7/2009 9:17,10/7/2009 9:36,1118,1r878018,1,5,1254932363,1,1019,"Let us consider the ""swine"" flu pandemic which is all the rage for the moment. WHO apparently started it to see how quickly it would travel the world. This set in motion a panic response by FDA and big pharma to get inocculations approved and then forced upon the public. The little we do know about these vaccines is that they have preservatives of mercury, aluminum and ?. We do not know what hazards they contain or what side effects they may induce (death?). In the last swine flu panic of the 1970's the cure killed more than the disease. There has never been a 100% cure rate, so by washing ones hands as the only preventitive with a 1/3 noncontract rate, that would be my choice.",,,,,,,,,,,,,,,,,,,,,,,,,,,,,,,,,,,,,,,,,,,,,,,,,,,,,,,,,,,,,,,,,,,,
125,COMPLETED,10/7/2009 9:22,10/7/2009 9:25,190,1r918437,4,5,,,,,,,,,,,,,1254932657,2,82,"There is a fair enough possibility that no one will die, so it would be better to try this option first.",,,,,,,,,,,,,,,,,,,,,,,,,,,,,,,,,,,,,,,,,,,,,,,,,,,,,,,,
126,COMPLETED,10/7/2009 9:24,10/7/2009 9:25,81,1r981042,17,5,,,,,,,,,,,,,,,,,,,,,,,,,,,,,,,,,,,,,,,,,,,,,,,,,,,,,,,,,,,,,,,,,1254932712,1,22,reward is worth the risk,,,,
127,COMPLETED,10/7/2009 9:29,10/12/2009 20:42,472372,1r336196,1,5,1254933072,2,472287,no reason,,,,,,,,,,,,,,,,,,,,,,,,,,,,,,,,,,,,,,,,,,,,,,,,,,,,,,,,,,,,,,,,,,,,
128,COMPLETED,10/7/2009 9:30,10/7/2009 9:31,59,1r314480,1,5,1254933077,2,19,I would rather take the option that allows us to save more people. ,,,,,,,,,,,,,,,,,,,,,,,,,,,,,,,,,,,,,,,,,,,,,,,,,,,,,,,,,,,,,,,,,,,,
129,COMPLETED,10/7/2009 9:32,10/7/2009 9:34,132,1r380196,2,5,,,,,1254933191,2,72,A says 400 WILL die.  B says 400 probably will die.  I'll take the bet,,,,,,,,,,,,,,,,,,,,,,,,,,,,,,,,,,,,,,,,,,,,,,,,,,,,,,,,,,,,,,,,
131,COMPLETED,10/7/2009 9:36,10/7/2009 9:39,179,1r939938,9,5,,,,,,,,,,,,,,,,,,,,,,,,,,,,,,,,,1254933517,2,71,B you are sure that 200 peole will be saved. A= thereis a 66 percent chance that no one will be saved.,,,,,,,,,,,,,,,,,,,,,,,,,,,,,,,,,,,,
132,COMPLETED,10/7/2009 9:40,10/7/2009 9:40,43,1r979051,18,5,,,,,,,,,,,,,,,,,,,,,,,,,,,,,,,,,,,,,,,,,,,,,,,,,,,,,,,,,,,,,,,,,,,,,1254933647,2,6,Less death
133,COMPLETED,10/7/2009 9:40,10/7/2009 9:40,43,1r246265,17,2,,,,,,,,,,,,,,,,,,,,,,,,,,,,,,,,,,,,,,,,,,,,,,,,,,,,,,,,,,,,,,,,,1254933640,1,18,don't know,,,,
134,COMPLETED,10/7/2009 9:41,10/7/2009 9:42,61,1r879037,3,5,,,,,,,,,1254933741,2,34,EV = .3333 * 600 + .6666 * 0  = 200.  That's one more person than 199.  ,,,,,,,,,,,,,,,,,,,,,,,,,,,,,,,,,,,,,,,,,,,,,,,,,,,,,,,,,,,,
135,COMPLETED,10/7/2009 9:42,10/7/2009 9:44,114,1r570985,12,5,,,,,,,,,,,,,,,,,,,,,,,,,,,,,,,,,,,,,,,,,,,,,1254933848,1,28,Less people would die although each is a 1/3 probablility of survival. ,,,,,,,,,,,,,,,,,,,,,,,,
136,COMPLETED,10/7/2009 9:45,10/7/2009 9:47,167,1r442397,14,5,,,,,,,,,,,,,,,,,,,,,,,,,,,,,,,,,,,,,,,,,,,,,,,,,,,,,1254933978,1,91,They are both saying the same thing but... I do not think people today can compute math in fractions so the first answer is a little more understandable.,,,,,,,,,,,,,,,,
137,COMPLETED,10/7/2009 9:49,10/7/2009 9:51,73,1r25349,8,5,,,,,,,,,,,,,,,,,,,,,,,,,,,,,1254934244,2,27,I would rather take the chance that no one would die,,,,,,,,,,,,,,,,,,,,,,,,,,,,,,,,,,,,,,,,
138,COMPLETED,10/7/2009 9:52,10/7/2009 9:54,101,1r605138,5,5,,,,,,,,,,,,,,,,,1254934422,1,26,201 is more than 200,,,,,,,,,,,,,,,,,,,,,,,,,,,,,,,,,,,,,,,,,,,,,,,,,,,,
140,COMPLETED,10/7/2009 10:04,10/10/2009 22:40,304563,1r857228,3,3,,,,,,,,,1255239615,1,5,none,,,,,,,,,,,,,,,,,,,,,,,,,,,,,,,,,,,,,,,,,,,,,,,,,,,,,,,,,,,,
143,COMPLETED,10/7/2009 10:06,10/7/2009 10:07,53,1r578468,10,5,,,,,,,,,,,,,,,,,,,,,,,,,,,,,,,,,,,,,1254935234,2,17,400 is less than 600,,,,,,,,,,,,,,,,,,,,,,,,,,,,,,,,
145,COMPLETED,10/7/2009 10:10,10/7/2009 10:11,64,1r991729,1,5,1254935494,1,21,guaranteed that some will survive,,,,,,,,,,,,,,,,,,,,,,,,,,,,,,,,,,,,,,,,,,,,,,,,,,,,,,,,,,,,,,,,,,,,
146,COMPLETED,10/7/2009 10:17,10/7/2009 10:19,109,1r461015,12,5,,,,,,,,,,,,,,,,,,,,,,,,,,,,,,,,,,,,,,,,,,,,,1254935940,1,37,,,,,,,,,,,,,,,,,,,,,,,,,
148,COMPLETED,10/7/2009 10:29,10/7/2009 10:30,65,1r318369,4,3,,,,,,,,,,,,,1254936607,2,24,"Plan B is a ""probability"" answer",,,,,,,,,,,,,,,,,,,,,,,,,,,,,,,,,,,,,,,,,,,,,,,,,,,,,,,,
149,COMPLETED,10/7/2009 10:30,10/7/2009 10:31,93,1r378289,5,5,,,,,,,,,,,,,,,,,1254936689,1,22,there is a guarantee that at least SOME people will be saved.,,,,,,,,,,,,,,,,,,,,,,,,,,,,,,,,,,,,,,,,,,,,,,,,,,,,
150,COMPLETED,10/7/2009 10:34,10/7/2009 10:35,99,1r325699,11,5,,,,,,,,,,,,,,,,,,,,,,,,,,,,,,,,,,,,,,,,,1254936913,2,36,I would take the chance that everyone could be saved,,,,,,,,,,,,,,,,,,,,,,,,,,,,
151,COMPLETED,10/7/2009 10:34,10/7/2009 10:35,62,1r459681,15,7,,,,,,,,,,,,,,,,,,,,,,,,,,,,,,,,,,,,,,,,,,,,,,,,,,,,,,,,,1254936913,2,24,Better to try and save everyone than the select few.,,,,,,,,,,,,
152,COMPLETED,10/7/2009 10:35,10/7/2009 10:38,177,1r991601,13,3,,,,,,,,,,,,,,,,,,,,,,,,,,,,,,,,,,,,,,,,,,,,,,,,,1254937014,1,88,I have to take into account that I CAN save 200 people.  Saving 200 people is better then saving none.  I have to take the route that I know will save some people.  The other way is all or nothing.  I can't gamble and lose everyone.  You have to save what you know you can save.,,,,,,,,,,,,,,,,,,,,
153,COMPLETED,10/7/2009 10:36,10/7/2009 10:38,168,1r302055,14,5,,,,,,,,,,,,,,,,,,,,,,,,,,,,,,,,,,,,,,,,,,,,,,,,,,,,,1254937009,2,119,The fact that there is a 1/3 probability that no one will die seems to be a better choice compared to Program A where  only 200 people would survive and 400 would still die.,,,,,,,,,,,,,,,,
154,COMPLETED,10/7/2009 10:38,10/7/2009 10:39,81,1r403914,7,5,,,,,,,,,,,,,,,,,,,,,,,,,1254937143,1,26,At least A there will be a specific number of people saved,,,,,,,,,,,,,,,,,,,,,,,,,,,,,,,,,,,,,,,,,,,,
155,COMPLETED,10/7/2009 10:43,10/7/2009 10:44,63,1r492096,18,5,,,,,,,,,,,,,,,,,,,,,,,,,,,,,,,,,,,,,,,,,,,,,,,,,,,,,,,,,,,,,,,,,,,,,1254937445,1,20,It is the most likely to save more people
156,COMPLETED,10/7/2009 10:45,10/7/2009 10:47,92,1r831737,9,5,,,,,,,,,,,,,,,,,,,,,,,,,,,,,,,,,1254937619,1,15,Prefer the chances,,,,,,,,,,,,,,,,,,,,,,,,,,,,,,,,,,,,
157,COMPLETED,10/7/2009 10:46,10/7/2009 10:48,117,1r521459,14,5,,,,,,,,,,,,,,,,,,,,,,,,,,,,,,,,,,,,,,,,,,,,,,,,,,,,,1254937665,1,40,i really didn't like either choise,,,,,,,,,,,,,,,,
158,COMPLETED,10/7/2009 10:51,10/7/2009 10:52,48,1r489028,17,5,,,,,,,,,,,,,,,,,,,,,,,,,,,,,,,,,,,,,,,,,,,,,,,,,,,,,,,,,,,,,,,,,1254937912,2,19,saving lives is very important,,,,
159,COMPLETED,10/7/2009 10:51,10/7/2009 10:52,60,1r527215,7,5,,,,,,,,,,,,,,,,,,,,,,,,,1254937945,2,30,The chance for saving more people is greater in b    There is a risk but I think one that is worth taking,,,,,,,,,,,,,,,,,,,,,,,,,,,,,,,,,,,,,,,,,,,,
160,COMPLETED,10/7/2009 10:53,10/7/2009 10:55,161,1r937354,13,5,,,,,,,,,,,,,,,,,,,,,,,,,,,,,,,,,,,,,,,,,,,,,,,,,1254938074,1,70,At least some people will be saved.  The other choice has a high possibility that no people will be saved.,,,,,,,,,,,,,,,,,,,,
161,COMPLETED,10/7/2009 10:56,10/7/2009 10:57,80,1r684489,1,5,1254938234,2,16,best rates,,,,,,,,,,,,,,,,,,,,,,,,,,,,,,,,,,,,,,,,,,,,,,,,,,,,,,,,,,,,,,,,,,,,
164,COMPLETED,10/7/2009 11:05,10/7/2009 11:06,50,1r912353,5,5,,,,,,,,,,,,,,,,,1254938754,1,10,better odds,,,,,,,,,,,,,,,,,,,,,,,,,,,,,,,,,,,,,,,,,,,,,,,,,,,,
165,COMPLETED,10/7/2009 11:05,10/7/2009 11:08,132,1r558518,9,5,,,,,,,,,,,,,,,,,,,,,,,,,,,,,,,,,1254938780,1,102,"I selected A just 'because' . No reason..I never believe  doctors nor scientists no matter what they say. They  take $$$$$ and do fake studies, poison animals and  get $$$$$ from companies to put in goofy data ...Nothing  they say will ever make me do anything. ",,,,,,,,,,,,,,,,,,,,,,,,,,,,,,,,,,,,
166,COMPLETED,10/7/2009 11:09,10/7/2009 11:13,215,1r457801,16,5,,,,,,,,,,,,,,,,,,,,,,,,,,,,,,,,,,,,,,,,,,,,,,,,,,,,,,,,,,,,,1254939034,2,147,answer A we know that 400 people will definitely die. In answer B we know that 400 people will probably die but obviously there is a chance that less than 400 people will die.  ,,,,,,,,
167,COMPLETED,10/7/2009 11:11,10/7/2009 11:13,98,1r937012,7,5,,,,,,,,,,,,,,,,,,,,,,,,,1254939133,2,49,THE ODDS ARE MORE FAVORABLE FOR THE GREATEST NUMBER OF SURVIVORS,,,,,,,,,,,,,,,,,,,,,,,,,,,,,,,,,,,,,,,,,,,,
168,COMPLETED,10/7/2009 11:21,10/7/2009 11:22,91,1r646773,13,5,,,,,,,,,,,,,,,,,,,,,,,,,,,,,,,,,,,,,,,,,,,,,,,,,1254939734,2,25,More people will be saved using plan B,,,,,,,,,,,,,,,,,,,,
169,COMPLETED,10/7/2009 11:37,10/7/2009 11:38,82,1r855619,9,5,,,,,,,,,,,,,,,,,,,,,,,,,,,,,,,,,1254940697,2,25,more people would be saved,,,,,,,,,,,,,,,,,,,,,,,,,,,,,,,,,,,,
170,COMPLETED,10/7/2009 11:42,10/7/2009 11:43,70,1r561719,4,5,,,,,,,,,,,,,1254941005,2,33,I am optimistic that although the odds are against us we will prevail and no one will die.,,,,,,,,,,,,,,,,,,,,,,,,,,,,,,,,,,,,,,,,,,,,,,,,,,,,,,,,
171,COMPLETED,10/7/2009 11:52,10/7/2009 11:53,68,1r547989,13,5,,,,,,,,,,,,,,,,,,,,,,,,,,,,,,,,,,,,,,,,,,,,,,,,,1254941590,2,22,1/3 just seems to be a little better,,,,,,,,,,,,,,,,,,,,
173,COMPLETED,10/7/2009 12:00,10/7/2009 12:03,156,1r540377,8,5,,,,,,,,,,,,,,,,,,,,,,,,,,,,,1254942117,2,71,neither answer matched the descriptions above but the 2nd description seemed more acceptable so I figured the 2nd answer would better fit my choice,,,,,,,,,,,,,,,,,,,,,,,,,,,,,,,,,,,,,,,,
174,COMPLETED,10/7/2009 12:07,10/7/2009 12:08,65,1r399551,7,5,,,,,,,,,,,,,,,,,,,,,,,,,1254942483,2,27,I would favor a system where there is a chance that all the people could be saved.,,,,,,,,,,,,,,,,,,,,,,,,,,,,,,,,,,,,,,,,,,,,
175,COMPLETED,10/7/2009 12:09,10/7/2009 12:10,84,1r481600,17,3,,,,,,,,,,,,,,,,,,,,,,,,,,,,,,,,,,,,,,,,,,,,,,,,,,,,,,,,,,,,,,,,,1254942631,2,27,I would rather select the option that has some people saved than the majority not being saved.,,,,
176,COMPLETED,10/7/2009 12:16,10/7/2009 12:19,147,1r299462,3,5,,,,,,,,,1254943091,1,52,I would take the sure thing,,,,,,,,,,,,,,,,,,,,,,,,,,,,,,,,,,,,,,,,,,,,,,,,,,,,,,,,,,,,
177,COMPLETED,10/7/2009 12:18,10/7/2009 12:19,71,1r346216,11,5,,,,,,,,,,,,,,,,,,,,,,,,,,,,,,,,,,,,,,,,,1254943124,1,34,"That sounds like a definite, the B sounds too much of a maybe, even if the numbers sound better.",,,,,,,,,,,,,,,,,,,,,,,,,,,,
178,COMPLETED,10/7/2009 12:20,10/7/2009 12:25,278,1r412574,14,3,,,,,,,,,,,,,,,,,,,,,,,,,,,,,,,,,,,,,,,,,,,,,,,,,,,,,1254943434,2,73,Both answer is the same as I see it. There is no wrong or right answer.,,,,,,,,,,,,,,,,
179,COMPLETED,10/7/2009 12:21,10/7/2009 12:22,68,1r365953,6,3,,,,,,,,,,,,,,,,,,,,,1254943326,1,9,some die some live,,,,,,,,,,,,,,,,,,,,,,,,,,,,,,,,,,,,,,,,,,,,,,,,
180,COMPLETED,10/7/2009 12:24,10/7/2009 12:26,90,1r776374,12,5,,,,,,,,,,,,,,,,,,,,,,,,,,,,,,,,,,,,,,,,,,,,,1254943536,1,39,four hundered is  better than the one -third,,,,,,,,,,,,,,,,,,,,,,,,
181,COMPLETED,10/7/2009 12:32,10/7/2009 12:37,257,1r341806,17,5,,,,,,,,,,,,,,,,,,,,,,,,,,,,,,,,,,,,,,,,,,,,,,,,,,,,,,,,,,,,,,,,,1254944071,1,160,"I think if there is a chance of saving everyone....instead of only 200, it may be worth the risk.  After all it was expected to kill 600 people anyway.",,,,
182,COMPLETED,10/7/2009 12:34,10/7/2009 12:36,71,1r519840,3,5,,,,,,,,,1254944131,2,33,"even though choice a is gaurenteed, Bwould save more if it worked!",,,,,,,,,,,,,,,,,,,,,,,,,,,,,,,,,,,,,,,,,,,,,,,,,,,,,,,,,,,,
183,COMPLETED,10/7/2009 12:37,10/7/2009 12:39,85,1r594283,6,5,,,,,,,,,,,,,,,,,,,,,1254944352,1,10,n/a,,,,,,,,,,,,,,,,,,,,,,,,,,,,,,,,,,,,,,,,,,,,,,,,
185,COMPLETED,10/7/2009 13:02,10/7/2009 13:04,84,1r675183,1,5,1254945807,2,42,I prefer to save as many people as possible.,,,,,,,,,,,,,,,,,,,,,,,,,,,,,,,,,,,,,,,,,,,,,,,,,,,,,,,,,,,,,,,,,,,,
186,COMPLETED,10/7/2009 13:02,10/7/2009 13:04,68,1r808142,16,5,,,,,,,,,,,,,,,,,,,,,,,,,,,,,,,,,,,,,,,,,,,,,,,,,,,,,,,,,,,,,1254945822,2,18,1/3 no one will die,,,,,,,,
187,COMPLETED,10/7/2009 13:05,10/7/2009 13:06,65,1r374396,4,5,,,,,,,,,,,,,1254945970,1,22,less people dead,,,,,,,,,,,,,,,,,,,,,,,,,,,,,,,,,,,,,,,,,,,,,,,,,,,,,,,,
188,COMPLETED,10/7/2009 13:07,10/7/2009 13:07,38,1r371560,5,5,,,,,,,,,,,,,,,,,1254946044,1,20,being sure of people saved is better than taking a chance,,,,,,,,,,,,,,,,,,,,,,,,,,,,,,,,,,,,,,,,,,,,,,,,,,,,
189,COMPLETED,10/7/2009 13:18,10/7/2009 13:21,207,1r1027788,18,5,,,,,,,,,,,,,,,,,,,,,,,,,,,,,,,,,,,,,,,,,,,,,,,,,,,,,,,,,,,,,,,,,,,,,1254946746,1,160,because program B is an absolute probability of 400 people dying whereas program A has a 66.6% chance that 600 people die. Therefore there is a 33.3% chance that less than 600 die. This could even be zero
190,COMPLETED,10/7/2009 13:22,10/12/2009 13:43,433262,1r414022,1,5,1255380147,1,38,"I would rather be assured that people will be saved, with a known successful program, than take a chance that no one will be saved.",,,,,,,,,,,,,,,,,,,,,,,,,,,,,,,,,,,,,,,,,,,,,,,,,,,,,,,,,,,,,,,,,,,,
191,COMPLETED,10/7/2009 13:23,10/7/2009 13:25,70,1r337499,2,5,,,,,1254947041,1,59,twi thirds is 400,,,,,,,,,,,,,,,,,,,,,,,,,,,,,,,,,,,,,,,,,,,,,,,,,,,,,,,,,,,,,,,,
192,COMPLETED,10/7/2009 13:27,10/7/2009 13:28,78,1r732172,12,5,,,,,,,,,,,,,,,,,,,,,,,,,,,,,,,,,,,,,,,,,,,,,1254947307,2,23,either one is correct,,,,,,,,,,,,,,,,,,,,,,,,
193,COMPLETED,10/7/2009 13:34,10/7/2009 13:36,104,1r536069,17,5,,,,,,,,,,,,,,,,,,,,,,,,,,,,,,,,,,,,,,,,,,,,,,,,,,,,,,,,,,,,,,,,,1254947748,1,30,the object is to save the most people,,,,
194,COMPLETED,10/7/2009 13:39,10/7/2009 13:40,90,1r68529,9,5,,,,,,,,,,,,,,,,,,,,,,,,,,,,,,,,,1254948009,2,36,"Program A has the chance of not saving anyone, so I chose the one that would at least save 200.",,,,,,,,,,,,,,,,,,,,,,,,,,,,,,,,,,,,
195,COMPLETED,10/7/2009 13:39,10/7/2009 13:40,78,1r377345,6,5,,,,,,,,,,,,,,,,,,,,,1254948028,2,11,not sure,,,,,,,,,,,,,,,,,,,,,,,,,,,,,,,,,,,,,,,,,,,,,,,,
196,COMPLETED,10/7/2009 13:39,10/7/2009 13:40,48,1r558459,14,3,,,,,,,,,,,,,,,,,,,,,,,,,,,,,,,,,,,,,,,,,,,,,,,,,,,,,1254948026,1,8,less people die,,,,,,,,,,,,,,,,
198,COMPLETED,10/7/2009 13:49,10/7/2009 13:50,45,1r44486,18,5,,,,,,,,,,,,,,,,,,,,,,,,,,,,,,,,,,,,,,,,,,,,,,,,,,,,,,,,,,,,,,,,,,,,,1254948601,2,11,less people would die
199,COMPLETED,10/7/2009 13:53,10/7/2009 13:54,88,1r64913,17,5,,,,,,,,,,,,,,,,,,,,,,,,,,,,,,,,,,,,,,,,,,,,,,,,,,,,,,,,,,,,,,,,,1254948838,2,31,Better to for sure save 200 than to possibly not save any.,,,,
201,COMPLETED,10/7/2009 14:01,10/7/2009 14:02,70,1r373894,3,5,,,,,,,,,1254949336,1,35,it is better to NOT gamble with lives on uncerftain treatments.,,,,,,,,,,,,,,,,,,,,,,,,,,,,,,,,,,,,,,,,,,,,,,,,,,,,,,,,,,,,
202,COMPLETED,10/7/2009 14:05,10/7/2009 14:06,64,1r329913,9,5,,,,,,,,,,,,,,,,,,,,,,,,,,,,,,,,,1254949555,2,25,It seem to be more precise,,,,,,,,,,,,,,,,,,,,,,,,,,,,,,,,,,,,
204,COMPLETED,10/7/2009 14:10,10/7/2009 14:11,54,1r243493,3,5,,,,,,,,,1254949858,1,21,I'd rather some people be saved and with B it is more likely that no one would be saved,,,,,,,,,,,,,,,,,,,,,,,,,,,,,,,,,,,,,,,,,,,,,,,,,,,,,,,,,,,,
205,COMPLETED,10/7/2009 14:12,10/12/2009 17:16,443041,1r980582,12,5,,,,,,,,,,,,,,,,,,,,,,,,,,,,,,,,,,,,,,,,,,,,,1254949963,2,443002,,,,,,,,,,,,,,,,,,,,,,,,,
206,COMPLETED,10/7/2009 14:16,10/7/2009 14:17,84,1r435094,15,5,,,,,,,,,,,,,,,,,,,,,,,,,,,,,,,,,,,,,,,,,,,,,,,,,,,,,,,,,1254950228,1,36,i would like to see people saved immediatly,,,,,,,,,,,,
207,COMPLETED,10/7/2009 14:19,10/7/2009 14:20,83,1r503203,16,5,,,,,,,,,,,,,,,,,,,,,,,,,,,,,,,,,,,,,,,,,,,,,,,,,,,,,,,,,,,,,1254950416,2,14,spare the people,,,,,,,,
208,COMPLETED,10/7/2009 14:19,10/7/2009 14:34,889,1r442202,8,4,,,,,,,,,,,,,,,,,,,,,,,,,,,,,1254951247,,3,,,,,,,,,,,,,,,,,,,,,,,,,,,,,,,,,,,,,,,,,
209,COMPLETED,10/7/2009 14:32,10/7/2009 14:34,85,1r289136,12,7,,,,,,,,,,,,,,,,,,,,,,,,,,,,,,,,,,,,,,,,,,,,,1254951228,2,34,Saving everyone is worth the risk.,,,,,,,,,,,,,,,,,,,,,,,,
210,COMPLETED,10/7/2009 14:33,10/7/2009 14:35,138,1r516313,13,5,,,,,,,,,,,,,,,,,,,,,,,,,,,,,,,,,,,,,,,,,,,,,,,,,1254951260,2,58,"The answer to each question is the same.  Either way, the loss is 400 people, however, question B is a CHANCE of losing those people.  Question A, there is a certainty of losing those people.",,,,,,,,,,,,,,,,,,,,
211,COMPLETED,10/7/2009 14:38,10/7/2009 14:44,328,1r381190,12,5,,,,,,,,,,,,,,,,,,,,,,,,,,,,,,,,,,,,,,,,,,,,,1254951595,2,248,400 people could die in option A   I prefer to gamble on saving more,,,,,,,,,,,,,,,,,,,,,,,,
212,COMPLETED,10/7/2009 14:43,10/7/2009 14:44,41,1r234421,4,5,,,,,,,,,,,,,1254951857,2,11,makes sense to me,,,,,,,,,,,,,,,,,,,,,,,,,,,,,,,,,,,,,,,,,,,,,,,,,,,,,,,,
213,COMPLETED,10/7/2009 14:45,10/7/2009 14:46,82,1r1054360,10,5,,,,,,,,,,,,,,,,,,,,,,,,,,,,,,,,,,,,,1254951971,1,25,THE GREATER SURVIVAL FOR THAT PROGRAM,,,,,,,,,,,,,,,,,,,,,,,,,,,,,,,,
214,COMPLETED,10/7/2009 14:48,10/7/2009 14:49,17,1r655966,8,3,,,,,,,,,,,,,,,,,,,,,,,,,,,,,1254952140,1,4,NA,,,,,,,,,,,,,,,,,,,,,,,,,,,,,,,,,,,,,,,,
215,COMPLETED,10/7/2009 15:03,10/7/2009 15:04,80,1r545791,12,5,,,,,,,,,,,,,,,,,,,,,,,,,,,,,,,,,,,,,,,,,,,,,1254953043,2,22,they are both the same. so I took the fractions.,,,,,,,,,,,,,,,,,,,,,,,,
216,COMPLETED,10/7/2009 15:22,10/7/2009 15:24,111,1r573443,9,5,,,,,,,,,,,,,,,,,,,,,,,,,,,,,,,,,1254954200,1,42,The risk is higher but the payoff is higher,,,,,,,,,,,,,,,,,,,,,,,,,,,,,,,,,,,,
217,COMPLETED,10/7/2009 15:37,10/7/2009 15:43,352,1r1039218,11,3,,,,,,,,,,,,,,,,,,,,,,,,,,,,,,,,,,,,,,,,,1254955093,1,301,"Program A will save 200 people. Program B has less than a 50% chance of saving anybody. Program B is not ready to be used and more work needs to be done to improve the product.  At least with the 1st program, 200 people will be definitley saved . I voted for A because peoples lives are not worth a risk . People should not be considered expendable based on projections of what ""might"" work. I say go with a product that will work, if even for only part of the population. ",,,,,,,,,,,,,,,,,,,,,,,,,,,,
218,COMPLETED,10/7/2009 15:42,10/7/2009 15:44,107,1r352222,17,5,,,,,,,,,,,,,,,,,,,,,,,,,,,,,,,,,,,,,,,,,,,,,,,,,,,,,,,,,,,,,,,,,1254955454,2,23,Program A may mean none are saved,,,,
219,COMPLETED,10/7/2009 15:47,10/7/2009 15:49,109,1r554568,6,5,,,,,,,,,,,,,,,,,,,,,1254955732,2,44,"About the same number of people die either way for sure but there is a chance for more to live in ""B"".",,,,,,,,,,,,,,,,,,,,,,,,,,,,,,,,,,,,,,,,,,,,,,,,
220,COMPLETED,10/7/2009 15:50,10/7/2009 15:51,65,1r526473,13,5,,,,,,,,,,,,,,,,,,,,,,,,,,,,,,,,,,,,,,,,,,,,,,,,,1254955860,2,21,Some risk but biggest  gain.,,,,,,,,,,,,,,,,,,,,
222,COMPLETED,10/7/2009 15:56,10/7/2009 15:57,79,1r619287,13,5,,,,,,,,,,,,,,,,,,,,,,,,,,,,,,,,,,,,,,,,,,,,,,,,,1254956224,1,36,200 people positively being saved is better than maybe 200 hundred being saved,,,,,,,,,,,,,,,,,,,,
223,COMPLETED,10/7/2009 15:58,10/7/2009 15:59,75,1r988931,16,5,,,,,,,,,,,,,,,,,,,,,,,,,,,,,,,,,,,,,,,,,,,,,,,,,,,,,,,,,,,,,1254956324,2,44,Because of the chance that all lives would be saved.  Also because I could not accept the possibility that 400 lives could possibly be lost.,,,,,,,,
224,COMPLETED,10/7/2009 16:18,10/7/2009 16:22,198,1r649922,10,5,,,,,,,,,,,,,,,,,,,,,,,,,,,,,,,,,,,,,1254957676,1,51,the ultimate toll probably is less than 400,,,,,,,,,,,,,,,,,,,,,,,,,,,,,,,,
225,COMPLETED,10/7/2009 16:22,10/7/2009 16:24,72,1r979769,13,5,,,,,,,,,,,,,,,,,,,,,,,,,,,,,,,,,,,,,,,,,,,,,,,,,1254957816,1,35,Option B has too great of a probability that no one will survive. At least A has some survivors,,,,,,,,,,,,,,,,,,,,
226,COMPLETED,10/7/2009 16:25,10/7/2009 16:27,107,1r941049,3,5,,,,,,,,,1254957985,1,49,Better to at least save some because the odds are too low to save all.,,,,,,,,,,,,,,,,,,,,,,,,,,,,,,,,,,,,,,,,,,,,,,,,,,,,,,,,,,,,
227,COMPLETED,10/7/2009 16:26,10/7/2009 16:29,189,1r357701,9,5,,,,,,,,,,,,,,,,,,,,,,,,,,,,,,,,,1254958037,1,117,"All the people should have a chance of being saved, instead of knowing as a fact that 2/3 of them won't.",,,,,,,,,,,,,,,,,,,,,,,,,,,,,,,,,,,,
228,COMPLETED,10/7/2009 16:29,10/7/2009 16:30,59,1r377509,8,5,,,,,,,,,,,,,,,,,,,,,,,,,,,,,1254958236,1,12,Better ods,,,,,,,,,,,,,,,,,,,,,,,,,,,,,,,,,,,,,,,,
229,COMPLETED,10/7/2009 16:32,10/7/2009 16:36,236,1r724369,5,5,,,,,,,,,,,,,,,,,1254958566,1,24,"Saving some people is always better than saving nobody, it's not worth the risk",,,,,,,,,,,,,,,,,,,,,,,,,,,,,,,,,,,,,,,,,,,,,,,,,,,,
230,COMPLETED,10/7/2009 16:32,10/7/2009 16:34,98,1r276577,11,5,,,,,,,,,,,,,,,,,,,,,,,,,,,,,,,,,,,,,,,,,1254958439,2,16,TO SAVE MORE POEPLE,,,,,,,,,,,,,,,,,,,,,,,,,,,,
231,COMPLETED,10/7/2009 16:33,10/7/2009 16:35,100,1r732318,4,5,,,,,,,,,,,,,1254958486,2,46,"The chance for no one to die makes it a better choice than knowing that 401 people will die... Hypocratic oath requires to ""do no harm"" whenever that is possible.",,,,,,,,,,,,,,,,,,,,,,,,,,,,,,,,,,,,,,,,,,,,,,,,,,,,,,,,
232,COMPLETED,10/7/2009 16:48,10/7/2009 16:49,42,1r402683,7,5,,,,,,,,,,,,,,,,,,,,,,,,,1254959372,2,8,hfgr,,,,,,,,,,,,,,,,,,,,,,,,,,,,,,,,,,,,,,,,,,,,
233,COMPLETED,10/7/2009 16:53,10/7/2009 16:54,89,1r132514,10,1,,,,,,,,,,,,,,,,,,,,,,,,,,,,,,,,,,,,,1254959666,1,21,The second choice guarantees death.,,,,,,,,,,,,,,,,,,,,,,,,,,,,,,,,
234,COMPLETED,10/7/2009 16:58,10/7/2009 16:59,47,1r501703,6,5,,,,,,,,,,,,,,,,,,,,,1254959941,2,12,higher odds of less dying,,,,,,,,,,,,,,,,,,,,,,,,,,,,,,,,,,,,,,,,,,,,,,,,
235,COMPLETED,10/7/2009 17:02,10/7/2009 17:04,119,1r858963,11,5,,,,,,,,,,,,,,,,,,,,,,,,,,,,,,,,,,,,,,,,,1254960197,2,80,"Because there is a 33% chance that everybody could survive, meaning that, even if all 600 people didn't survive, then there is a decent chance that more than 200 people would live.",,,,,,,,,,,,,,,,,,,,,,,,,,,,
236,COMPLETED,10/7/2009 17:04,10/7/2009 17:06,124,1r1033281,14,5,,,,,,,,,,,,,,,,,,,,,,,,,,,,,,,,,,,,,,,,,,,,,,,,,,,,,1254960348,2,69,"I feel like the deaths of 200 people are being bet on, basically.  Under the first scenario, there are 400 certain deaths and 200 certain undeaths.  But people are going to die.  In the second scenario, there is the possibility that no one will die and I am willing to risk the lives of those 200 people to prevent possibly 400 people from dying.",,,,,,,,,,,,,,,,
237,COMPLETED,10/7/2009 17:09,10/7/2009 17:12,177,1r682412,9,5,,,,,,,,,,,,,,,,,,,,,,,,,,,,,,,,,1254960733,1,35,I'm a gambler. I like the odds.,,,,,,,,,,,,,,,,,,,,,,,,,,,,,,,,,,,,
238,COMPLETED,10/7/2009 17:15,10/7/2009 17:16,55,1r554884,4,7,,,,,,,,,,,,,1254960962,2,17,math wise,,,,,,,,,,,,,,,,,,,,,,,,,,,,,,,,,,,,,,,,,,,,,,,,,,,,,,,,
239,COMPLETED,10/7/2009 17:16,10/7/2009 17:18,133,1r695302,8,5,,,,,,,,,,,,,,,,,,,,,,,,,,,,,1254961073,1,31,I assumed a=c and b=d,,,,,,,,,,,,,,,,,,,,,,,,,,,,,,,,,,,,,,,,
240,COMPLETED,10/7/2009 17:23,10/7/2009 17:27,244,1r368535,11,5,,,,,,,,,,,,,,,,,,,,,,,,,,,,,,,,,,,,,,,,,1254961457,1,186,"because with (A),  200 people would be saved. with (B), there is a 66.6% probability that no one would survive. In the (A) scenario, at least one third would live.",,,,,,,,,,,,,,,,,,,,,,,,,,,,
241,COMPLETED,10/7/2009 17:27,10/7/2009 17:42,941,1r622231,18,5,,,,,,,,,,,,,,,,,,,,,,,,,,,,,,,,,,,,,,,,,,,,,,,,,,,,,,,,,,,,,,,,,,,,,1254962555,2,24,more people are expected to survive
242,COMPLETED,10/7/2009 17:36,10/7/2009 17:38,92,1r457942,7,5,,,,,,,,,,,,,,,,,,,,,,,,,1254962257,1,35,The first option gives me the best odds of at least some people surviving.,,,,,,,,,,,,,,,,,,,,,,,,,,,,,,,,,,,,,,,,,,,,
243,COMPLETED,10/7/2009 17:49,10/7/2009 17:50,57,1r343267,5,7,,,,,,,,,,,,,,,,,1254963015,2,12,all or nothing,,,,,,,,,,,,,,,,,,,,,,,,,,,,,,,,,,,,,,,,,,,,,,,,,,,,
245,COMPLETED,10/7/2009 18:22,10/7/2009 18:22,44,1r711013,14,5,,,,,,,,,,,,,,,,,,,,,,,,,,,,,,,,,,,,,,,,,,,,,,,,,,,,,1254964958,2,19,had to pick one and did not really like either choice,,,,,,,,,,,,,,,,
246,COMPLETED,10/7/2009 18:23,10/7/2009 18:25,133,1r1013480,18,5,,,,,,,,,,,,,,,,,,,,,,,,,,,,,,,,,,,,,,,,,,,,,,,,,,,,,,,,,,,,,,,,,,,,,1254965092,1,39,"You didn't offer any other choices.  Both answers come out the same.  I had to make a choice, so I went with A."
247,COMPLETED,10/7/2009 18:40,10/7/2009 18:42,82,1r400600,4,5,,,,,,,,,,,,,1254966112,1,26,Program A allows for a definite chance that some of the people will survive.,,,,,,,,,,,,,,,,,,,,,,,,,,,,,,,,,,,,,,,,,,,,,,,,,,,,,,,,
