1334,COMPLETED,10/11/2009 19:43,10/11/2009 19:44,84,1r3681153,11,5,,,,,,,,,,,,,,,,,,,,,,,,,,,,,,,,,,,,,,,,,1255315463,1,36,both of the answers are almost the same and the 1st one is much less confusing.,,,,,,,,,,,,,,,,,,,,,,,,,,,,
1335,COMPLETED,10/11/2009 19:49,10/11/2009 19:50,75,1r942098,14,5,,,,,,,,,,,,,,,,,,,,,,,,,,,,,,,,,,,,,,,,,,,,,,,,,,,,,1255315828,1,13,i like the odds,,,,,,,,,,,,,,,,
1336,COMPLETED,10/11/2009 19:54,10/11/2009 19:56,68,1r3484923,12,5,,,,,,,,,,,,,,,,,,,,,,,,,,,,,,,,,,,,,,,,,,,,,1255316140,2,21,"400 is still a lot of people, and I would hope that no one would have to die. ",,,,,,,,,,,,,,,,,,,,,,,,
1339,COMPLETED,10/11/2009 21:35,10/11/2009 21:36,106,1r2226307,10,5,,,,,,,,,,,,,,,,,,,,,,,,,,,,,,,,,,,,,1255322174,1,39,One third chance of no one being killed was worth the risk.,,,,,,,,,,,,,,,,,,,,,,,,,,,,,,,,
1340,COMPLETED,10/11/2009 21:45,10/11/2009 21:48,197,1r2180511,4,5,,,,,,,,,,,,,1255322854,2,56,"because there's a chance that no one will die; the first option ""guaranteed"" that 401 people would die.",,,,,,,,,,,,,,,,,,,,,,,,,,,,,,,,,,,,,,,,,,,,,,,,,,,,,,,,
1341,COMPLETED,10/11/2009 22:14,10/11/2009 22:18,229,1r3672247,9,5,,,,,,,,,,,,,,,,,,,,,,,,,,,,,,,,,1255324638,1,60,"The ""probability"" of 600 people surviving seemed better than losing 400.",,,,,,,,,,,,,,,,,,,,,,,,,,,,,,,,,,,,
1342,COMPLETED,10/11/2009 22:36,10/11/2009 22:37,49,1r2647019,10,5,,,,,,,,,,,,,,,,,,,,,,,,,,,,,,,,,,,,,1255325843,2,7,?,,,,,,,,,,,,,,,,,,,,,,,,,,,,,,,,
1343,COMPLETED,10/11/2009 22:45,10/11/2009 22:46,78,1r3681627,1,5,1255326344,1,36,rather have 1/3 live than a 2/3 possibility that all would die,,,,,,,,,,,,,,,,,,,,,,,,,,,,,,,,,,,,,,,,,,,,,,,,,,,,,,,,,,,,,,,,,,,,
1344,COMPLETED,10/12/2009 0:42,10/12/2009 0:47,303,1r2929061,13,5,,,,,,,,,,,,,,,,,,,,,,,,,,,,,,,,,,,,,,,,,,,,,,,,,1255333603,1,27,"If there is a chance to save people, I would take that chance.",,,,,,,,,,,,,,,,,,,,
1345,COMPLETED,10/12/2009 1:31,10/12/2009 1:32,61,1r1401422,12,5,,,,,,,,,,,,,,,,,,,,,,,,,,,,,,,,,,,,,,,,,,,,,1255336309,1,24,400 less than 600,,,,,,,,,,,,,,,,,,,,,,,,
1346,COMPLETED,10/12/2009 2:18,10/12/2009 2:20,101,1r542404,11,5,,,,,,,,,,,,,,,,,,,,,,,,,,,,,,,,,,,,,,,,,1255339170,2,58,"I feel that it is better to try to save as many as possible.besides that, I believe that should one die, there is a reserection",,,,,,,,,,,,,,,,,,,,,,,,,,,,
1347,COMPLETED,10/12/2009 2:59,10/12/2009 3:00,83,1r1807383,6,5,,,,,,,,,,,,,,,,,,,,,1255341608,1,25,I prefer none - but this was the lowest number,,,,,,,,,,,,,,,,,,,,,,,,,,,,,,,,,,,,,,,,,,,,,,,,
1348,COMPLETED,10/12/2009 3:58,10/12/2009 4:00,118,1r3382451,3,5,,,,,,,,,1255345156,1,48,the odds are greater for more people to survive,,,,,,,,,,,,,,,,,,,,,,,,,,,,,,,,,,,,,,,,,,,,,,,,,,,,,,,,,,,,
1349,COMPLETED,10/12/2009 4:41,10/12/2009 4:42,56,1r3198060,7,5,,,,,,,,,,,,,,,,,,,,,,,,,1255347743,1,15,at least some will be saved,,,,,,,,,,,,,,,,,,,,,,,,,,,,,,,,,,,,,,,,,,,,
1350,COMPLETED,10/12/2009 5:16,10/12/2009 5:17,54,1r1290374,16,5,,,,,,,,,,,,,,,,,,,,,,,,,,,,,,,,,,,,,,,,,,,,,,,,,,,,,,,,,,,,,1255349832,1,11,Less would die,,,,,,,,
1351,COMPLETED,10/12/2009 5:19,10/12/2009 5:20,50,1r2931741,8,5,,,,,,,,,,,,,,,,,,,,,,,,,,,,,1255349995,2,8,,,,,,,,,,,,,,,,,,,,,,,,,,,,,,,,,,,,,,,,,
1352,COMPLETED,10/12/2009 5:29,10/12/2009 5:31,113,1r2296181,13,5,,,,,,,,,,,,,,,,,,,,,,,,,,,,,,,,,,,,,,,,,,,,,,,,,1255350634,2,58,I was going for the possibility of saving more people than the certainty of saving only the few that would defiantly be saved.  ,,,,,,,,,,,,,,,,,,,,
1353,COMPLETED,10/12/2009 5:50,10/12/2009 5:54,224,1r2967000,14,3,,,,,,,,,,,,,,,,,,,,,,,,,,,,,,,,,,,,,,,,,,,,,,,,,,,,,1255351968,1,109,"I didn't like either probablility..but the first, no matter which way you look at it, is less of a mortality rate",,,,,,,,,,,,,,,,
1354,COMPLETED,10/12/2009 6:00,10/12/2009 6:01,51,1r3674637,14,1,,,,,,,,,,,,,,,,,,,,,,,,,,,,,,,,,,,,,,,,,,,,,,,,,,,,,1255352484,2,18,more people will live,,,,,,,,,,,,,,,,
1355,COMPLETED,10/12/2009 6:17,10/12/2009 6:19,88,1r4059264,13,3,,,,,,,,,,,,,,,,,,,,,,,,,,,,,,,,,,,,,,,,,,,,,,,,,1255353488,1,54,guarenteed that 400 can be saved instead of a chance no one survives,,,,,,,,,,,,,,,,,,,,
1358,COMPLETED,10/12/2009 6:31,10/12/2009 6:33,125,1r4048270,18,5,,,,,,,,,,,,,,,,,,,,,,,,,,,,,,,,,,,,,,,,,,,,,,,,,,,,,,,,,,,,,,,,,,,,,1255354421,1,18,Theres a chance no one will die
1359,COMPLETED,10/12/2009 6:43,10/12/2009 6:44,54,1r3970195,17,5,,,,,,,,,,,,,,,,,,,,,,,,,,,,,,,,,,,,,,,,,,,,,,,,,,,,,,,,,,,,,,,,,1255355066,2,17,Guaranteed to have 200 people survive.,,,,
1360,COMPLETED,10/12/2009 6:44,10/12/2009 6:45,64,1r1271323,5,5,,,,,,,,,,,,,,,,,1255355117,1,20,trying to assure the greatest good,,,,,,,,,,,,,,,,,,,,,,,,,,,,,,,,,,,,,,,,,,,,,,,,,,,,
1361,COMPLETED,10/12/2009 6:52,10/12/2009 6:54,108,1r3899658,18,5,,,,,,,,,,,,,,,,,,,,,,,,,,,,,,,,,,,,,,,,,,,,,,,,,,,,,,,,,,,,,,,,,,,,,1255355592,1,65,"With the B option there is no ""probably die"", 400 people will die. Option A gives the idea that there is a chance that more people will be saved."
1362,COMPLETED,10/12/2009 7:19,10/12/2009 7:20,98,1r1920388,17,5,,,,,,,,,,,,,,,,,,,,,,,,,,,,,,,,,,,,,,,,,,,,,,,,,,,,,,,,,,,,,,,,,1255357200,2,38,It is for sure that 200 people will be saved. Program A offers only the possibility that 200 people are saved,,,,
1363,COMPLETED,10/12/2009 7:19,10/12/2009 7:20,87,1r50445,16,7,,,,,,,,,,,,,,,,,,,,,,,,,,,,,,,,,,,,,,,,,,,,,,,,,,,,,,,,,,,,,1255357193,2,48,"I don't know.  If there's a chance to save lives, I think we should take it.",,,,,,,,
1365,COMPLETED,10/12/2009 7:30,10/12/2009 7:32,82,1r3621154,3,5,,,,,,,,,1255357923,2,12,A chance to save everyone,,,,,,,,,,,,,,,,,,,,,,,,,,,,,,,,,,,,,,,,,,,,,,,,,,,,,,,,,,,,
1366,COMPLETED,10/12/2009 7:39,10/12/2009 7:40,46,1r3115875,1,5,1255358391,1,18,ou lose either way but less it seems with a,,,,,,,,,,,,,,,,,,,,,,,,,,,,,,,,,,,,,,,,,,,,,,,,,,,,,,,,,,,,,,,,,,,,
1368,COMPLETED,10/12/2009 7:56,10/12/2009 8:15,1147,1r4025860,18,5,,,,,,,,,,,,,,,,,,,,,,,,,,,,,,,,,,,,,,,,,,,,,,,,,,,,,,,,,,,,,,,,,,,,,1255360504,2,10,less people will die
1369,COMPLETED,10/12/2009 8:00,10/12/2009 8:01,85,1r3989977,5,5,,,,,,,,,,,,,,,,,1255359652,1,42,"Under A, there was a chance that 1/3 of the people would be saved, but under B, there was a 2/3 chance that no one would be saved.",,,,,,,,,,,,,,,,,,,,,,,,,,,,,,,,,,,,,,,,,,,,,,,,,,,,
1370,COMPLETED,10/12/2009 8:13,10/12/2009 8:16,222,1r4039300,12,5,,,,,,,,,,,,,,,,,,,,,,,,,,,,,,,,,,,,,,,,,,,,,1255360511,1,100,"Well, my brain isn't functioning at 100% right now...but if there is a 2/3 chance that everybody(all 600) I wouldn't want to take that option.",,,,,,,,,,,,,,,,,,,,,,,,
1371,COMPLETED,10/12/2009 8:16,10/12/2009 8:17,41,1r3895299,7,5,,,,,,,,,,,,,,,,,,,,,,,,,1255360623,1,8,the odds seem better,,,,,,,,,,,,,,,,,,,,,,,,,,,,,,,,,,,,,,,,,,,,
1372,COMPLETED,10/12/2009 8:17,10/12/2009 8:19,124,1r2700671,5,5,,,,,,,,,,,,,,,,,1255360680,1,65,it is better to save one than none. 2/3 probability of no one being saved is not favorable in my opinion.,,,,,,,,,,,,,,,,,,,,,,,,,,,,,,,,,,,,,,,,,,,,,,,,,,,,
1373,COMPLETED,10/12/2009 8:27,10/12/2009 8:28,82,1r2121961,10,5,,,,,,,,,,,,,,,,,,,,,,,,,,,,,,,,,,,,,1255361295,1,21,Because there is the probability that no one will die,,,,,,,,,,,,,,,,,,,,,,,,,,,,,,,,
1374,COMPLETED,10/12/2009 8:40,10/12/2009 8:41,69,1r3196469,16,5,,,,,,,,,,,,,,,,,,,,,,,,,,,,,,,,,,,,,,,,,,,,,,,,,,,,,,,,,,,,,1255362055,2,19,There is a chance that no one will die.,,,,,,,,
1375,COMPLETED,10/12/2009 9:00,10/12/2009 9:02,118,1r3505298,12,5,,,,,,,,,,,,,,,,,,,,,,,,,,,,,,,,,,,,,,,,,,,,,1255363291,2,69,33% change that no one will die is preferable to knowing for certain that 400people will die.    Statistically they are equivalant.,,,,,,,,,,,,,,,,,,,,,,,,
1376,COMPLETED,10/12/2009 9:06,10/12/2009 9:08,91,1r1570278,1,5,1255363641,1,44,"This is way too hard of a question to answer.  Both are not good choices, so I was not liking either answer.  I chose the first answer because at least 200 could be saved.  With the second answer, there is a good chance no one would be saved.",,,,,,,,,,,,,,,,,,,,,,,,,,,,,,,,,,,,,,,,,,,,,,,,,,,,,,,,,,,,,,,,,,,,
1377,COMPLETED,10/12/2009 9:09,10/12/2009 9:10,105,1r1312643,1,5,1255363803,2,46,2/3 is better tha 200,,,,,,,,,,,,,,,,,,,,,,,,,,,,,,,,,,,,,,,,,,,,,,,,,,,,,,,,,,,,,,,,,,,,
1378,COMPLETED,10/12/2009 9:10,10/12/2009 9:12,119,1r3990231,10,5,,,,,,,,,,,,,,,,,,,,,,,,,,,,,,,,,,,,,1255363884,2,78,It seems the better choice. 1/3 of all people is much more than 400 people. ,,,,,,,,,,,,,,,,,,,,,,,,,,,,,,,,
1379,COMPLETED,10/12/2009 9:16,10/12/2009 9:18,102,1r4037638,5,5,,,,,,,,,,,,,,,,,1255364275,2,22,There is a chance to save everyone.,,,,,,,,,,,,,,,,,,,,,,,,,,,,,,,,,,,,,,,,,,,,,,,,,,,,
1380,COMPLETED,10/12/2009 9:31,10/12/2009 9:32,80,1r1397512,6,1,,,,,,,,,,,,,,,,,,,,,1255365138,2,23,sounds the best ,,,,,,,,,,,,,,,,,,,,,,,,,,,,,,,,,,,,,,,,,,,,,,,,
1381,COMPLETED,10/12/2009 10:05,10/12/2009 10:05,43,1r3831070,15,5,,,,,,,,,,,,,,,,,,,,,,,,,,,,,,,,,,,,,,,,,,,,,,,,,,,,,,,,,1255367136,2,11,make more sense,,,,,,,,,,,,
1382,COMPLETED,10/12/2009 10:13,10/12/2009 10:14,70,1r3917034,9,5,,,,,,,,,,,,,,,,,,,,,,,,,,,,,,,,,1255367627,1,28,Lucky guess?,,,,,,,,,,,,,,,,,,,,,,,,,,,,,,,,,,,,
1383,COMPLETED,10/12/2009 10:20,10/12/2009 10:22,118,1r3275647,10,5,,,,,,,,,,,,,,,,,,,,,,,,,,,,,,,,,,,,,1255368096,1,62,"Both were about the same, with two stating for sure 400 will die!",,,,,,,,,,,,,,,,,,,,,,,,,,,,,,,,
1385,COMPLETED,10/12/2009 10:26,10/12/2009 10:29,179,1r3191301,3,5,,,,,,,,,1255368547,1,31,The value of how many people will be definitely cured is better than a guess.,,,,,,,,,,,,,,,,,,,,,,,,,,,,,,,,,,,,,,,,,,,,,,,,,,,,,,,,,,,,
1386,COMPLETED,10/12/2009 10:29,10/12/2009 10:30,40,1r1768253,7,5,,,,,,,,,,,,,,,,,,,,,,,,,1255368632,2,6,no clue,,,,,,,,,,,,,,,,,,,,,,,,,,,,,,,,,,,,,,,,,,,,
1387,COMPLETED,10/12/2009 11:07,10/12/2009 11:08,70,1r3547749,16,5,,,,,,,,,,,,,,,,,,,,,,,,,,,,,,,,,,,,,,,,,,,,,,,,,,,,,,,,,,,,,1255370863,2,28,At least you have a slight odd that no one will die,,,,,,,,
1389,COMPLETED,10/12/2009 11:08,10/12/2009 11:09,64,1r3521328,17,5,,,,,,,,,,,,,,,,,,,,,,,,,,,,,,,,,,,,,,,,,,,,,,,,,,,,,,,,,,,,,,,,,1255370975,1,18,"they are both the same number of people being saved, i just chose one",,,,
1391,COMPLETED,10/12/2009 11:15,10/12/2009 11:16,76,1r2858183,3,5,,,,,,,,,1255371364,1,19,"I like to be guaranteed, not take chances that no one will survive.",,,,,,,,,,,,,,,,,,,,,,,,,,,,,,,,,,,,,,,,,,,,,,,,,,,,,,,,,,,,
1393,COMPLETED,10/12/2009 11:16,10/12/2009 11:18,97,1r735983,10,5,,,,,,,,,,,,,,,,,,,,,,,,,,,,,,,,,,,,,1255371463,2,21,The probabiility of less dying.,,,,,,,,,,,,,,,,,,,,,,,,,,,,,,,,
1394,COMPLETED,10/12/2009 11:17,10/12/2009 11:19,123,1r970522,18,5,,,,,,,,,,,,,,,,,,,,,,,,,,,,,,,,,,,,,,,,,,,,,,,,,,,,,,,,,,,,,,,,,,,,,1255371503,1,55,"even though both programs rendered the same number of deaths, the visual impact of the fractions seemed less"
1396,COMPLETED,10/12/2009 11:21,10/12/2009 11:23,102,1r2792832,10,5,,,,,,,,,,,,,,,,,,,,,,,,,,,,,,,,,,,,,1255371757,2,25,Because there is a chance that less people will die.,,,,,,,,,,,,,,,,,,,,,,,,,,,,,,,,
1397,COMPLETED,10/12/2009 11:26,10/12/2009 11:28,98,1r3350937,16,5,,,,,,,,,,,,,,,,,,,,,,,,,,,,,,,,,,,,,,,,,,,,,,,,,,,,,,,,,,,,,1255372070,1,36,I didn't like the odds,,,,,,,,
1398,COMPLETED,10/12/2009 11:27,10/12/2009 11:29,112,1r399850,13,5,,,,,,,,,,,,,,,,,,,,,,,,,,,,,,,,,,,,,,,,,,,,,,,,,1255372129,2,36,"not sure, but that all the answer you left me.",,,,,,,,,,,,,,,,,,,,
1399,COMPLETED,10/12/2009 11:28,10/12/2009 11:29,40,1r2952539,11,1,,,,,,,,,,,,,,,,,,,,,,,,,,,,,,,,,,,,,,,,,1255372128,2,16,The odds of more people being saved are greater,,,,,,,,,,,,,,,,,,,,,,,,,,,,
1400,COMPLETED,10/12/2009 11:28,10/12/2009 11:30,82,1r550120,11,5,,,,,,,,,,,,,,,,,,,,,,,,,,,,,,,,,,,,,,,,,1255372178,2,22,everybody should be included in the probability ,,,,,,,,,,,,,,,,,,,,,,,,,,,,
1401,COMPLETED,10/12/2009 11:29,10/12/2009 11:33,262,1r806248,10,5,,,,,,,,,,,,,,,,,,,,,,,,,,,,,,,,,,,,,1255372196,1,207,In our society any chance at all of lessining deaths is perferable over certain death.  in the first choice it ranges from 600 deaths to no deaths.  An average of under 400 is preferable to a certain 400.,,,,,,,,,,,,,,,,,,,,,,,,,,,,,,,,
1402,COMPLETED,10/12/2009 11:30,10/12/2009 11:35,273,1r4054984,14,5,,,,,,,,,,,,,,,,,,,,,,,,,,,,,,,,,,,,,,,,,,,,,,,,,,,,,1255372307,1,220,"I think it's better to deal with exact numbers than with percentages! If I know I'm going to save 200 lives up front without even second guessing then I would do it! With the second choice, it's all or nothing, if the chances fall into the 2/3 option of everyone dying, then I've lost everyone instead of just 400. A 66666667% chance of losing 600 people is to great of a deficit to consider!",,,,,,,,,,,,,,,,
1403,COMPLETED,10/12/2009 11:37,10/12/2009 11:39,131,1r2962718,4,5,,,,,,,,,,,,,1255372724,1,57,odds are more people will die in the second option.,,,,,,,,,,,,,,,,,,,,,,,,,,,,,,,,,,,,,,,,,,,,,,,,,,,,,,,,
1404,COMPLETED,10/12/2009 11:45,10/12/2009 11:46,61,1r880306,9,5,,,,,,,,,,,,,,,,,,,,,,,,,,,,,,,,,1255373198,1,12,chance to save all,,,,,,,,,,,,,,,,,,,,,,,,,,,,,,,,,,,,
1405,COMPLETED,10/12/2009 11:48,10/12/2009 11:49,70,1r467656,12,5,,,,,,,,,,,,,,,,,,,,,,,,,,,,,,,,,,,,,,,,,,,,,1255373373,2,20,I would rather take a chance that no one would die,,,,,,,,,,,,,,,,,,,,,,,,
1406,COMPLETED,10/12/2009 11:53,10/12/2009 11:56,177,1r1953181,12,3,,,,,,,,,,,,,,,,,,,,,,,,,,,,,,,,,,,,,,,,,,,,,1255373741,2,47,"the results are the same, either way 400 die.",,,,,,,,,,,,,,,,,,,,,,,,
1407,COMPLETED,10/12/2009 11:59,10/12/2009 12:00,71,1r455634,16,5,,,,,,,,,,,,,,,,,,,,,,,,,,,,,,,,,,,,,,,,,,,,,,,,,,,,,,,,,,,,,1255374020,1,18,seems less of a risk,,,,,,,,
1409,COMPLETED,10/12/2009 12:04,10/12/2009 12:06,123,1r501125,12,3,,,,,,,,,,,,,,,,,,,,,,,,,,,,,,,,,,,,,,,,,,,,,1255374310,1,56,There is a greater possibilty of some people surviving,,,,,,,,,,,,,,,,,,,,,,,,
1410,COMPLETED,10/12/2009 12:04,10/12/2009 12:06,129,1r910238,3,5,,,,,,,,,1255374381,2,10,seems better,,,,,,,,,,,,,,,,,,,,,,,,,,,,,,,,,,,,,,,,,,,,,,,,,,,,,,,,,,,,
1411,COMPLETED,10/12/2009 12:08,10/12/2009 12:10,72,1r380516,9,5,,,,,,,,,,,,,,,,,,,,,,,,,,,,,,,,,1255374593,2,14,guarantee vs. risk,,,,,,,,,,,,,,,,,,,,,,,,,,,,,,,,,,,,
1412,COMPLETED,10/12/2009 12:10,10/12/2009 12:11,102,1r3123227,18,5,,,,,,,,,,,,,,,,,,,,,,,,,,,,,,,,,,,,,,,,,,,,,,,,,,,,,,,,,,,,,,,,,,,,,1255374667,1,37,"Because of the probability, it seemed like less people would die with that program"
1413,COMPLETED,10/12/2009 12:10,10/12/2009 12:12,126,1r704564,9,5,,,,,,,,,,,,,,,,,,,,,,,,,,,,,,,,,1255374689,2,74,the 200 saved seems more reasonable than taking the chance that no one will be saved.,,,,,,,,,,,,,,,,,,,,,,,,,,,,,,,,,,,,
1414,COMPLETED,10/12/2009 12:10,10/12/2009 12:11,70,1r1251079,12,5,,,,,,,,,,,,,,,,,,,,,,,,,,,,,,,,,,,,,,,,,,,,,1255374693,2,22,chance no one would die,,,,,,,,,,,,,,,,,,,,,,,,
1415,COMPLETED,10/12/2009 12:11,10/12/2009 12:14,172,1r589185,17,5,,,,,,,,,,,,,,,,,,,,,,,,,,,,,,,,,,,,,,,,,,,,,,,,,,,,,,,,,,,,,,,,,1255374774,1,113,BETTER TO SHOOT FOR THE 1/3 WITH THE POSSIBILTY OF 100% SAVED THEN TO ACCEPT THAT 2/3 WILL NOT MAKE IT PERIOD,,,,
1416,COMPLETED,10/12/2009 12:13,10/12/2009 12:17,236,1r946189,3,5,,,,,,,,,1255374871,1,178,A  Will save lives for sure. B There is a 66% possabilty that no one will be saved.,,,,,,,,,,,,,,,,,,,,,,,,,,,,,,,,,,,,,,,,,,,,,,,,,,,,,,,,,,,,
1417,COMPLETED,10/12/2009 12:16,10/12/2009 12:17,64,1r2759234,4,5,,,,,,,,,,,,,1255375039,2,24,You can't favor something that is guaranteed to kill that many people.  Go for the odds.,,,,,,,,,,,,,,,,,,,,,,,,,,,,,,,,,,,,,,,,,,,,,,,,,,,,,,,,
1418,COMPLETED,10/12/2009 12:17,10/12/2009 12:18,108,1r341172,14,5,,,,,,,,,,,,,,,,,,,,,,,,,,,,,,,,,,,,,,,,,,,,,,,,,,,,,1255375090,2,48,it's better to take the chance and have nobody die,,,,,,,,,,,,,,,,
1419,COMPLETED,10/12/2009 12:17,10/12/2009 12:19,111,1r2384671,13,5,,,,,,,,,,,,,,,,,,,,,,,,,,,,,,,,,,,,,,,,,,,,,,,,,1255375126,1,31,1/2 better than 1/3,,,,,,,,,,,,,,,,,,,,
1420,COMPLETED,10/12/2009 12:20,10/12/2009 12:21,81,1r543703,18,5,,,,,,,,,,,,,,,,,,,,,,,,,,,,,,,,,,,,,,,,,,,,,,,,,,,,,,,,,,,,,,,,,,,,,1255375286,1,20,I like the numbers better
1421,COMPLETED,10/12/2009 12:21,10/12/2009 12:22,50,1r1113563,14,5,,,,,,,,,,,,,,,,,,,,,,,,,,,,,,,,,,,,,,,,,,,,,,,,,,,,,1255375306,1,17,less people would die,,,,,,,,,,,,,,,,
1422,COMPLETED,10/12/2009 12:23,10/12/2009 12:31,455,1r1672430,15,3,,,,,,,,,,,,,,,,,,,,,,,,,,,,,,,,,,,,,,,,,,,,,,,,,,,,,,,,,1255375502,1,359,"I fell that option A is the best choice because there is a diffenate 66% survival rate, where as plan B has a 66% chance of total failure and no noe survives.      I TAKE MY CHANCE ON PLAN A",,,,,,,,,,,,
1423,COMPLETED,10/12/2009 12:23,10/12/2009 12:24,47,1r1913719,4,5,,,,,,,,,,,,,1255375460,2,16,trust luck,,,,,,,,,,,,,,,,,,,,,,,,,,,,,,,,,,,,,,,,,,,,,,,,,,,,,,,,
1424,COMPLETED,10/12/2009 12:25,10/12/2009 12:27,160,1r827485,17,5,,,,,,,,,,,,,,,,,,,,,,,,,,,,,,,,,,,,,,,,,,,,,,,,,,,,,,,,,,,,,,,,,1255375616,2,45,It just seems better to go with the program that has some guarantee of success.,,,,
1426,COMPLETED,10/12/2009 12:29,10/12/2009 12:30,76,1r1436842,15,5,,,,,,,,,,,,,,,,,,,,,,,,,,,,,,,,,,,,,,,,,,,,,,,,,,,,,,,,,1255375806,2,43,My view is that doing anything to save all 600 people is great chance to take since how many people live on the continent? ,,,,,,,,,,,,
1427,COMPLETED,10/12/2009 12:30,10/12/2009 12:30,20,1r3606797,12,5,,,,,,,,,,,,,,,,,,,,,,,,,,,,,,,,,,,,,,,,,,,,,1255375818,1,9,i like it,,,,,,,,,,,,,,,,,,,,,,,,
1428,COMPLETED,10/12/2009 12:32,10/12/2009 12:36,220,1r2278577,9,5,,,,,,,,,,,,,,,,,,,,,,,,,,,,,,,,,1255376088,2,75,odds are very much against all being saved and my not save any in first option where for sure 1/3 will be saved in second option.  I use the bird in the hand is worth two in the bush theory. :),,,,,,,,,,,,,,,,,,,,,,,,,,,,,,,,,,,,
1429,COMPLETED,10/12/2009 12:34,10/12/2009 12:35,75,1r2428530,2,5,,,,,1255376093,2,31,"I'm an all or nothing type of person, either it will work or not.",,,,,,,,,,,,,,,,,,,,,,,,,,,,,,,,,,,,,,,,,,,,,,,,,,,,,,,,,,,,,,,,
1430,COMPLETED,10/12/2009 12:34,10/12/2009 12:37,136,1r1654603,2,5,,,,,1255376171,2,55,There is a slight chance that no one will die.  Our chances of having 600 die are the same in either case (the original scenario and program B).,,,,,,,,,,,,,,,,,,,,,,,,,,,,,,,,,,,,,,,,,,,,,,,,,,,,,,,,,,,,,,,,
1431,COMPLETED,10/12/2009 12:35,10/12/2009 12:36,86,1r3917471,17,5,,,,,,,,,,,,,,,,,,,,,,,,,,,,,,,,,,,,,,,,,,,,,,,,,,,,,,,,,,,,,,,,,1255376176,2,39,because it is definete that 200 peope will be saved - the other had a greater possibility of no one being saved,,,,
1433,COMPLETED,10/12/2009 12:36,10/12/2009 12:37,73,1r1660706,18,5,,,,,,,,,,,,,,,,,,,,,,,,,,,,,,,,,,,,,,,,,,,,,,,,,,,,,,,,,,,,,,,,,,,,,1255376243,1,23,Because no one will die.
1434,COMPLETED,10/12/2009 12:38,10/12/2009 12:41,158,1r405779,15,5,,,,,,,,,,,,,,,,,,,,,,,,,,,,,,,,,,,,,,,,,,,,,,,,,,,,,,,,,1255376390,1,85,"Program A guarantees 200 people will be saved whereas the second program is going on probability which may be favorable, but there is no quarantee.",,,,,,,,,,,,
1436,COMPLETED,10/12/2009 12:39,10/12/2009 12:40,59,1r2341031,16,5,,,,,,,,,,,,,,,,,,,,,,,,,,,,,,,,,,,,,,,,,,,,,,,,,,,,,,,,,,,,,1255376419,2,26,any possability to live is better than none,,,,,,,,
1437,COMPLETED,10/12/2009 12:40,10/12/2009 12:43,208,1r453476,8,2,,,,,,,,,,,,,,,,,,,,,,,,,,,,,1255376496,2,112,Well it was avery tough one to chose.  I chose B though because there is a chance that the outcome could be minimally catastophic (despite the chance that it could be quite catastophic).  Choice A it is assumed that definitely 400 people will die.  Not the best odds.,,,,,,,,,,,,,,,,,,,,,,,,,,,,,,,,,,,,,,,,
1438,COMPLETED,10/12/2009 12:40,10/12/2009 12:41,69,1r1019574,13,5,,,,,,,,,,,,,,,,,,,,,,,,,,,,,,,,,,,,,,,,,,,,,,,,,1255376485,2,7,na,,,,,,,,,,,,,,,,,,,,
1439,COMPLETED,10/12/2009 12:41,10/12/2009 12:42,89,1r320416,7,5,,,,,,,,,,,,,,,,,,,,,,,,,1255376510,2,54,Seems like a better chance of more people surviving with the second option- I like that option better.,,,,,,,,,,,,,,,,,,,,,,,,,,,,,,,,,,,,,,,,,,,,
1440,COMPLETED,10/12/2009 12:41,10/12/2009 12:45,223,1r3624529,8,3,,,,,,,,,,,,,,,,,,,,,,,,,,,,,1255376556,2,157,"Based on how much testing was done peoples age, living condition, surroundings and work place all have effects on treating people for diseases.   ",,,,,,,,,,,,,,,,,,,,,,,,,,,,,,,,,,,,,,,,
1441,COMPLETED,10/12/2009 12:43,10/12/2009 12:44,57,1r394740,5,5,,,,,,,,,,,,,,,,,1255376630,1,17,strongr chance of survival ,,,,,,,,,,,,,,,,,,,,,,,,,,,,,,,,,,,,,,,,,,,,,,,,,,,,
1442,COMPLETED,10/12/2009 12:43,10/12/2009 12:46,166,1r526480,18,5,,,,,,,,,,,,,,,,,,,,,,,,,,,,,,,,,,,,,,,,,,,,,,,,,,,,,,,,,,,,,,,,,,,,,1255376655,2,127,Because  if people use good hand washing the odds are better- the vaccine is a joke-just to benefit the DRUG COMPANIES!!
1443,COMPLETED,10/12/2009 12:43,10/12/2009 12:44,68,1r281436,4,5,,,,,,,,,,,,,1255376657,2,30,There is a probability that fewer will die.,,,,,,,,,,,,,,,,,,,,,,,,,,,,,,,,,,,,,,,,,,,,,,,,,,,,,,,,
1444,COMPLETED,10/12/2009 12:45,10/12/2009 12:45,38,1r808130,5,5,,,,,,,,,,,,,,,,,1255376744,2,12,Want to save as many people as possible.,,,,,,,,,,,,,,,,,,,,,,,,,,,,,,,,,,,,,,,,,,,,,,,,,,,,
1445,COMPLETED,10/12/2009 12:47,10/12/2009 12:50,185,1r3666886,8,5,,,,,,,,,,,,,,,,,,,,,,,,,,,,,1255376900,2,121,"For one, you didn't list a Program B, you listed a Program C and D.  I assumed the latter, that which was D, would be Program B.      Better to have a 1 in 3 chance of saving everyone.  Either way, you lose 2/3, so you might as well try for the 1/3.",,,,,,,,,,,,,,,,,,,,,,,,,,,,,,,,,,,,,,,,
1446,COMPLETED,10/12/2009 12:48,10/12/2009 12:48,50,1r924265,9,5,,,,,,,,,,,,,,,,,,,,,,,,,,,,,,,,,1255376921,2,10,NA,,,,,,,,,,,,,,,,,,,,,,,,,,,,,,,,,,,,
1448,COMPLETED,10/12/2009 12:51,10/12/2009 12:55,237,1r152421,10,5,,,,,,,,,,,,,,,,,,,,,,,,,,,,,,,,,,,,,1255377275,2,62,"I wasn't sure of the total amout of people involved, so thought 400 people dying were less than 600 people dying",,,,,,,,,,,,,,,,,,,,,,,,,,,,,,,,
1450,COMPLETED,10/12/2009 12:54,10/12/2009 13:05,635,1r2247501,12,5,,,,,,,,,,,,,,,,,,,,,,,,,,,,,,,,,,,,,,,,,,,,,1255377414,2,492,"Simple-real world evaluations show there are zero absolutes in estimates, so for any study to even suggest that this many WILL die, or WON'T die is absurd and not worth serious scientific consideration. There are ALWAYS odds as no two people are the same, just as no two immune systems are the same. There are WAY too many variables to consider to assume absolutes-one size does NOT fit all, and past evidence also backs up the fact that the ""remedy"" has often killed more than the disease itself...hence, the ""variable"" factor.  Therefore, common sense says to go with the option that gives odds or percentages, and dismiss the ones with any claims of absolutes. We fell for such things amidst the recent fanatical junk science obsession, and they are falling apart at the seams. No thanks. Life is always a risk, with no guarantees. The science community needs to get away from the political influences that try to introduce such ""absolutes"", which have no business in science, which has been more detrimental to such ""studies"" as anything. The ""absolute"" notion was the tipoff right away.",,,,,,,,,,,,,,,,,,,,,,,,
1452,COMPLETED,10/12/2009 12:57,10/12/2009 12:58,97,1r574315,7,5,,,,,,,,,,,,,,,,,,,,,,,,,1255377472,2,58,chance that more than 200 would be saved. like to chance things,,,,,,,,,,,,,,,,,,,,,,,,,,,,,,,,,,,,,,,,,,,,
1451,COMPLETED,10/12/2009 12:57,10/12/2009 12:58,50,1r2267998,7,5,,,,,,,,,,,,,,,,,,,,,,,,,1255377463,2,20,youi save as many people as possible,,,,,,,,,,,,,,,,,,,,,,,,,,,,,,,,,,,,,,,,,,,,
1453,COMPLETED,10/12/2009 12:58,10/12/2009 13:00,122,1r1236931,10,5,,,,,,,,,,,,,,,,,,,,,,,,,,,,,,,,,,,,,1255377565,1,59,Like the uncertainty in the first one,,,,,,,,,,,,,,,,,,,,,,,,,,,,,,,,
1454,COMPLETED,10/12/2009 12:59,10/12/2009 13:00,67,1r2006067,9,5,,,,,,,,,,,,,,,,,,,,,,,,,,,,,,,,,1255377603,2,16,Because it gave an exact number. ,,,,,,,,,,,,,,,,,,,,,,,,,,,,,,,,,,,,
1455,COMPLETED,10/12/2009 13:00,10/12/2009 13:01,98,1r251427,13,5,,,,,,,,,,,,,,,,,,,,,,,,,,,,,,,,,,,,,,,,,,,,,,,,,1255377656,2,44,I don't see either program being better than the other. 400 would die in each example correct?,,,,,,,,,,,,,,,,,,,,
1456,COMPLETED,10/12/2009 13:03,10/12/2009 13:08,343,1r569535,9,5,,,,,,,,,,,,,,,,,,,,,,,,,,,,,,,,,1255377858,1,275,roll the dice. It's either all or some. Plan B people would be so anxious that they might not be tin those 200 I would think it would cause a bit of an uproar!,,,,,,,,,,,,,,,,,,,,,,,,,,,,,,,,,,,,
1457,COMPLETED,10/12/2009 13:04,10/12/2009 13:08,248,1r752564,6,5,,,,,,,,,,,,,,,,,,,,,1255378064,1,69,"A and B have identical results, it's the same thing. Will die 400 persons in A or B.",,,,,,,,,,,,,,,,,,,,,,,,,,,,,,,,,,,,,,,,,,,,,,,,
1458,COMPLETED,10/12/2009 13:05,10/12/2009 13:08,192,1r3577096,12,5,,,,,,,,,,,,,,,,,,,,,,,,,,,,,,,,,,,,,,,,,,,,,1255377989,2,111,"Well it sounds like to me that program ""A"" guarantees that 400 people will die no matter what, where as program ""B"" allows at least the chance for human continuity.",,,,,,,,,,,,,,,,,,,,,,,,
1459,COMPLETED,10/12/2009 13:05,10/12/2009 13:07,102,1r562027,3,5,,,,,,,,,1255377982,2,39,if there is a probablity that you could save all 600 people then it is worth the 2/3 risk that this program would fail.,,,,,,,,,,,,,,,,,,,,,,,,,,,,,,,,,,,,,,,,,,,,,,,,,,,,,,,,,,,,
1460,COMPLETED,10/12/2009 13:07,10/12/2009 13:08,65,1r2460318,2,5,,,,,1255378092,1,29,WELL 600 PEOPLE WILL DIE.....,,,,,,,,,,,,,,,,,,,,,,,,,,,,,,,,,,,,,,,,,,,,,,,,,,,,,,,,,,,,,,,,
